cleaned_comment,slang_replaced_comment,tekonized_comment,no_stopwords_comment,stemmed_comment
minta pendapatnya sat udah kerja saja lah klo udah kerja ya bisa tau sndri gmna hasil kerja nya,minta pendapatnya sat sudah kerja saja lah kalau sudah kerja ya bisa tau sendiri gmna hasil kerja nya,"['minta', 'pendapatnya', 'sat', 'sudah', 'kerja', 'saja', 'lah', 'kalau', 'sudah', 'kerja', 'ya', 'bisa', 'tau', 'sendiri', 'gmna', 'hasil', 'kerja', 'nya']","['minta', 'pendapatnya', 'sat', 'kerja', 'lah', 'kalau', 'kerja', 'tau', 'sendiri', 'gmna', 'hasil', 'kerja', 'nya']","['minta', 'dapat', 'sat', 'kerja', 'lah', 'kalau', 'kerja', 'tau', 'sendiri', 'gmna', 'hasil', 'kerja', 'nya']"
ga jelas keputusan pemerintah ini memang di dunia ini tidak ada negara besar yang maju di pimpin tentara,tidak jelas keputusan pemerintah ini memang di dunia ini tidak ada negara besar yang maju di pimpin tentara,"['tidak', 'jelas', 'keputusan', 'pemerintah', 'ini', 'memang', 'di', 'dunia', 'ini', 'tidak', 'ada', 'negara', 'besar', 'yang', 'maju', 'di', 'pimpin', 'tentara']","['tidak', 'jelas', 'keputusan', 'pemerintah', 'memang', 'dunia', 'tidak', 'negara', 'besar', 'maju', 'pimpin', 'tentara']","['tidak', 'jelas', 'putus', 'perintah', 'memang', 'dunia', 'tidak', 'negara', 'besar', 'maju', 'pimpin', 'tentara']"
anak elektro moga dia tau ilmu dasar ekonomi,anak elektro moga dia tau ilmu dasar ekonomi,"['anak', 'elektro', 'moga', 'dia', 'tau', 'ilmu', 'dasar', 'ekonomi']","['anak', 'elektro', 'moga', 'tau', 'ilmu', 'dasar', 'ekonomi']","['anak', 'elektro', 'moga', 'tau', 'ilmu', 'dasar', 'ekonomi']"
yang penting bukan org imf,yang penting bukan orang imf,"['yang', 'penting', 'bukan', 'orang', 'imf']","['penting', 'bukan', 'orang', 'imf']","['penting', 'bukan', 'orang', 'imf']"
 patah hati min,patah hati admin,"['patah', 'hati', 'admin']","['patah', 'hati', 'admin']","['patah', 'hati', 'admin']"
kesempatan serok,kesempatan serok,"['kesempatan', 'serok']","['kesempatan', 'serok']","['sempat', 'serok']"
mnrt saya bu sri emang lebih baik d ganti krn sdh terlalu lama mengemban jabatan negeri ini perlu org yg lebih baik menangani krisis ekonomi d negeri ini semoga saja para baya bs lebih baik lg ,mnrt aku ibu sri memang lebih baik di ganti karena sdh terlalu lama mengemban jabatan negeri ini perlu orang yang lebih baik menangani krisis ekonomi di negeri ini semoga saja para baya bisa lebih baik lagi,"['mnrt', 'aku', 'ibu', 'sri', 'memang', 'lebih', 'baik', 'di', 'ganti', 'karena', 'sdh', 'terlalu', 'lama', 'mengemban', 'jabatan', 'negeri', 'ini', 'perlu', 'orang', 'yang', 'lebih', 'baik', 'menangani', 'krisis', 'ekonomi', 'di', 'negeri', 'ini', 'semoga', 'saja', 'para', 'baya', 'bisa', 'lebih', 'baik', 'lagi']","['mnrt', 'aku', 'ibu', 'sri', 'memang', 'lebih', 'baik', 'ganti', 'sdh', 'terlalu', 'lama', 'mengemban', 'jabatan', 'negeri', 'perlu', 'orang', 'lebih', 'baik', 'menangani', 'krisis', 'ekonomi', 'negeri', 'semoga', 'baya', 'lebih', 'baik']","['mnrt', 'aku', 'ibu', 'sri', 'memang', 'lebih', 'baik', 'ganti', 'sdh', 'terlalu', 'lama', 'emban', 'jabat', 'negeri', 'perlu', 'orang', 'lebih', 'baik', 'tangan', 'krisis', 'ekonomi', 'negeri', 'moga', 'baya', 'lebih', 'baik']"
kurang bagus deh,kurang bagus deh,"['kurang', 'bagus', 'deh']","['kurang', 'bagus', 'deh']","['kurang', 'bagus', 'deh']"
berdoalah beliau amanah amin,berdoalah beliau amanah amin,"['berdoalah', 'beliau', 'amanah', 'amin']","['berdoalah', 'beliau', 'amanah', 'amin']","['doa', 'beliau', 'amanah', 'amin']"
dunia mengakui di negeri sendiri dihantui,dunia mengakui di negeri sendiri dihantui,"['dunia', 'mengakui', 'di', 'negeri', 'sendiri', 'dihantui']","['dunia', 'mengakui', 'negeri', 'sendiri', 'dihantui']","['dunia', 'aku', 'negeri', 'sendiri', 'hantu']"
pakai matamu bisa ngetik tapi gak bisa baca,pakai matamu bisa ngetik tapi tidak bisa baca,"['pakai', 'matamu', 'bisa', 'ngetik', 'tapi', 'tidak', 'bisa', 'baca']","['pakai', 'matamu', 'ngetik', 'tidak', 'baca']","['pakai', 'mata', 'ngetik', 'tidak', 'baca']"
semoga amanah dan sukses menaikan pertumbuhan ekonomi,semoga amanah dan sukses menaikan pertumbuhan ekonomi,"['semoga', 'amanah', 'dan', 'sukses', 'menaikan', 'pertumbuhan', 'ekonomi']","['semoga', 'amanah', 'sukses', 'menaikan', 'pertumbuhan', 'ekonomi']","['moga', 'amanah', 'sukses', 'naik', 'tumbuh', 'ekonomi']"
mundur lahcapek dikerjain mulucek dnk ig pribadi menkeu baru ,mundur lahcapek dikerjain mulucek dnk ig pribadi menkeu baru,"['mundur', 'lahcapek', 'dikerjain', 'mulucek', 'dnk', 'ig', 'pribadi', 'menkeu', 'baru']","['mundur', 'lahcapek', 'dikerjain', 'mulucek', 'dnk', 'ig', 'pribadi', 'menkeu', 'baru']","['mundur', 'lahcapek', 'dikerjain', 'mulucek', 'dnk', 'ig', 'pribadi', 'menkeu', 'baru']"
bung pengi said kenapa sri mulyani jabat menkeu dari jaman sby sekarang ya karena pejabat di nina boboin beliau ,bung pengi said kenapa sri mulyani jabat menkeu dari zaman surabaya sekarang ya karena pejabat di nina boboin beliau,"['bung', 'pengi', 'said', 'kenapa', 'sri', 'mulyani', 'jabat', 'menkeu', 'dari', 'zaman', 'surabaya', 'sekarang', 'ya', 'karena', 'pejabat', 'di', 'nina', 'boboin', 'beliau']","['bung', 'pengi', 'said', 'sri', 'mulyani', 'jabat', 'menkeu', 'zaman', 'surabaya', 'sekarang', 'pejabat', 'nina', 'boboin', 'beliau']","['bung', 'pengi', 'said', 'sri', 'mulyani', 'jabat', 'menkeu', 'zaman', 'surabaya', 'sekarang', 'jabat', 'nina', 'boboin', 'beliau']"
belum apa apa udah bikin statement yg kurang bagus,belum apa apa sudah bikin statement yang kurang bagus,"['belum', 'apa', 'apa', 'sudah', 'bikin', 'statement', 'yang', 'kurang', 'bagus']","['belum', 'apa', 'apa', 'bikin', 'statement', 'kurang', 'bagus']","['belum', 'apa', 'apa', 'bikin', 'statement', 'kurang', 'bagus']"
pak prabowo kalo memilih orang pasti tidak sembarang kecuali titipan merdeka ,bapak prabowo kalau memilih orang pasti tidak sembarang kecuali titipan merdeka,"['bapak', 'prabowo', 'kalau', 'memilih', 'orang', 'pasti', 'tidak', 'sembarang', 'kecuali', 'titipan', 'merdeka']","['bapak', 'prabowo', 'kalau', 'memilih', 'orang', 'tidak', 'sembarang', 'titipan', 'merdeka']","['bapak', 'prabowo', 'kalau', 'pilih', 'orang', 'tidak', 'sembarang', 'titip', 'merdeka']"
selamat purna tugas bu sri,selamat purna tugas ibu sri,"['selamat', 'purna', 'tugas', 'ibu', 'sri']","['selamat', 'purna', 'tugas', 'ibu', 'sri']","['selamat', 'purna', 'tugas', 'ibu', 'sri']"
kita lihat aja nanti belum bisa dinilai sekarang yg penting hasil,kita lihat saja nanti belum bisa dinilai sekarang yang penting hasil,"['kita', 'lihat', 'saja', 'nanti', 'belum', 'bisa', 'dinilai', 'sekarang', 'yang', 'penting', 'hasil']","['lihat', 'belum', 'dinilai', 'sekarang', 'penting', 'hasil']","['lihat', 'belum', 'nilai', 'sekarang', 'penting', 'hasil']"
biarlah gp ganti gak bagus jg klo kelaman menjabatpsti ad titik jenuh nya dia,biarlah gp ganti tidak bagus juga kalau kelaman menjabatpsti ada titik jenuh nya dia,"['biarlah', 'gp', 'ganti', 'tidak', 'bagus', 'juga', 'kalau', 'kelaman', 'menjabatpsti', 'ada', 'titik', 'jenuh', 'nya', 'dia']","['biarlah', 'gp', 'ganti', 'tidak', 'bagus', 'kalau', 'kelaman', 'menjabatpsti', 'titik', 'jenuh', 'nya']","['biar', 'gp', 'ganti', 'tidak', 'bagus', 'kalau', 'kelam', 'menjabatpsti', 'titik', 'jenuh', 'nya']"
tetap geng solo itu ganti baju saja,tetap geng solo itu ganti baju saja,"['tetap', 'geng', 'solo', 'itu', 'ganti', 'baju', 'saja']","['tetap', 'geng', 'solo', 'ganti', 'baju']","['tetap', 'geng', 'solo', 'ganti', 'baju']"
yg jelas hari ini ihsg longsor,yang jelas hari ini ihsg longsor,"['yang', 'jelas', 'hari', 'ini', 'ihsg', 'longsor']","['jelas', 'hari', 'ihsg', 'longsor']","['jelas', 'hari', 'ihsg', 'longsor']"
 halah pret kemaren suruh mundur giliran udah di ganti blablablablala netizen ,halah pret kemarin suruh mundur giliran sudah di ganti blablablablala netizen,"['halah', 'pret', 'kemarin', 'suruh', 'mundur', 'giliran', 'sudah', 'di', 'ganti', 'blablablablala', 'netizen']","['halah', 'pret', 'kemarin', 'suruh', 'mundur', 'giliran', 'ganti', 'blablablablala', 'netizen']","['halah', 'pret', 'kemarin', 'suruh', 'mundur', 'gilir', 'ganti', 'blablablablala', 'netizen']"
kenapa yg ganti gak menkeu sby era periode kedua sih juga teruji kok,kenapa yang ganti tidak menkeu surabaya era periode kedua sih juga teruji kok,"['kenapa', 'yang', 'ganti', 'tidak', 'menkeu', 'surabaya', 'era', 'periode', 'kedua', 'sih', 'juga', 'teruji', 'kok']","['ganti', 'tidak', 'menkeu', 'surabaya', 'era', 'periode', 'kedua', 'sih', 'teruji', 'kok']","['ganti', 'tidak', 'menkeu', 'surabaya', 'era', 'periode', 'dua', 'sih', 'uji', 'kok']"
lihat pidato pak purbaya katanya akan mempelajari dlu maksudnya apa saya kira paham masalahnya lebih cakap bu sri mulyani sepetinya tapi ya sudahlahsemoga ada yg lebih baik dari beliau,lihat pidato bapak purbaya katanya akan mempelajari dulu maksudnya apa aku kira paham masalahnya lebih bicara ibu sri mulyani sepetinya tapi ya sudahlahsemoga ada yang lebih baik dari beliau,"['lihat', 'pidato', 'bapak', 'purbaya', 'katanya', 'akan', 'mempelajari', 'dulu', 'maksudnya', 'apa', 'aku', 'kira', 'paham', 'masalahnya', 'lebih', 'bicara', 'ibu', 'sri', 'mulyani', 'sepetinya', 'tapi', 'ya', 'sudahlahsemoga', 'ada', 'yang', 'lebih', 'baik', 'dari', 'beliau']","['lihat', 'pidato', 'bapak', 'purbaya', 'katanya', 'mempelajari', 'dulu', 'maksudnya', 'apa', 'aku', 'kira', 'paham', 'masalahnya', 'lebih', 'bicara', 'ibu', 'sri', 'mulyani', 'sepetinya', 'sudahlahsemoga', 'lebih', 'baik', 'beliau']","['lihat', 'pidato', 'bapak', 'purbaya', 'kata', 'ajar', 'dulu', 'maksud', 'apa', 'aku', 'kira', 'paham', 'masalah', 'lebih', 'bicara', 'ibu', 'sri', 'mulyani', 'sepet', 'sudahlahsemoga', 'lebih', 'baik', 'beliau']"
god job pak purbaya ,tuhan pekerjaan bapak purbaya,"['tuhan', 'pekerjaan', 'bapak', 'purbaya']","['tuhan', 'pekerjaan', 'bapak', 'purbaya']","['tuhan', 'kerja', 'bapak', 'purbaya']"
pecat saja pak udah gaji besar dari pegawai lain ngak disiplinkami dukung pak menkeu,pecat saja bapak sudah gaji besar dari pegawai lain tidak disiplinkami dukung bapak menkeu,"['pecat', 'saja', 'bapak', 'sudah', 'gaji', 'besar', 'dari', 'pegawai', 'lain', 'tidak', 'disiplinkami', 'dukung', 'bapak', 'menkeu']","['pecat', 'bapak', 'gaji', 'besar', 'pegawai', 'tidak', 'disiplinkami', 'dukung', 'bapak', 'menkeu']","['pecat', 'bapak', 'gaji', 'besar', 'pegawai', 'tidak', 'disiplinkami', 'dukung', 'bapak', 'menkeu']"
semua sudah tradisi dari dulu yg belum beraturan dari paling atas sampai ke bawah di instansinstansi nya negeri ini ,semua sudah tradisi dari dulu yang belum beraturan dari paling atas sampai ke bawah di instansinstansi nya negeri ini,"['semua', 'sudah', 'tradisi', 'dari', 'dulu', 'yang', 'belum', 'beraturan', 'dari', 'paling', 'atas', 'sampai', 'ke', 'bawah', 'di', 'instansinstansi', 'nya', 'negeri', 'ini']","['semua', 'tradisi', 'dulu', 'belum', 'beraturan', 'paling', 'atas', 'bawah', 'instansinstansi', 'nya', 'negeri']","['semua', 'tradisi', 'dulu', 'belum', 'atur', 'paling', 'atas', 'bawah', 'instansinstansi', 'nya', 'negeri']"
pecat sj pak menkeu,pecat sj bapak menkeu,"['pecat', 'sj', 'bapak', 'menkeu']","['pecat', 'sj', 'bapak', 'menkeu']","['pecat', 'sj', 'bapak', 'menkeu']"
dari dlu pada kerja nya gth pa sekarang cuman bpa yang bisa bikin indoesia maju jdi pecat pa yang pingin gajih gde kerja cuman memperkya diri pect pa biar tau,dari dulu pada kerja nya gth bapak sekarang hanya bpa yang bisa bikin indoesia maju jadi pecat bapak yang ingin gajih gde kerja hanya memperkya diri pect bapak biar tau,"['dari', 'dulu', 'pada', 'kerja', 'nya', 'gth', 'bapak', 'sekarang', 'hanya', 'bpa', 'yang', 'bisa', 'bikin', 'indoesia', 'maju', 'jadi', 'pecat', 'bapak', 'yang', 'ingin', 'gajih', 'gde', 'kerja', 'hanya', 'memperkya', 'diri', 'pect', 'bapak', 'biar', 'tau']","['dulu', 'kerja', 'nya', 'gth', 'bapak', 'sekarang', 'bpa', 'bikin', 'indoesia', 'maju', 'jadi', 'pecat', 'bapak', 'gajih', 'gde', 'kerja', 'memperkya', 'diri', 'pect', 'bapak', 'biar', 'tau']","['dulu', 'kerja', 'nya', 'gth', 'bapak', 'sekarang', 'bpa', 'bikin', 'indoesia', 'maju', 'jadi', 'pecat', 'bapak', 'gajih', 'gde', 'kerja', 'memperkya', 'diri', 'pect', 'bapak', 'biar', 'tau']"
mayan makan gratis lg ya pak wkwk masak terus pak kasih bumbu yg enak,lumayan makan gratis lagi ya bapak wkwk masak terus bapak kasih bumbu yang enak,"['lumayan', 'makan', 'gratis', 'lagi', 'ya', 'bapak', 'wkwk', 'masak', 'terus', 'bapak', 'kasih', 'bumbu', 'yang', 'enak']","['lumayan', 'makan', 'gratis', 'bapak', 'wkwk', 'masak', 'terus', 'bapak', 'kasih', 'bumbu', 'enak']","['lumayan', 'makan', 'gratis', 'bapak', 'wkwk', 'masak', 'terus', 'bapak', 'kasih', 'bumbu', 'enak']"
semangat pak ,semangat bapak,"['semangat', 'bapak']","['semangat', 'bapak']","['semangat', 'bapak']"
bapak diminta untuk menghadap ke bapak presiden sekarang juga ,bapak diminta untuk menghadap ke bapak presiden sekarang juga,"['bapak', 'diminta', 'untuk', 'menghadap', 'ke', 'bapak', 'presiden', 'sekarang', 'juga']","['bapak', 'diminta', 'menghadap', 'bapak', 'presiden', 'sekarang']","['bapak', 'minta', 'hadap', 'bapak', 'presiden', 'sekarang']"
makin kesini makin suka sm pak mentri ,makin kesini makin suka sama bapak mentri,"['makin', 'kesini', 'makin', 'suka', 'sama', 'bapak', 'mentri']","['makin', 'kesini', 'makin', 'suka', 'sama', 'bapak', 'mentri']","['makin', 'kesini', 'makin', 'suka', 'sama', 'bapak', 'tri']"
mantap lah,mantap lah,"['mantap', 'lah']","['mantap', 'lah']","['mantap', 'lah']"
view hiden coments,view hiden coments,"['view', 'hiden', 'coments']","['view', 'hiden', 'coments']","['view', 'hiden', 'coments']"
let cok,let jancuk,"['let', 'jancuk']","['let', 'jancuk']","['let', 'jancuk']"
diundang wapres kpn pak bahas fiscal dan moneter ,diundang wapres kpn bapak bahas fiscal dan moneter,"['diundang', 'wapres', 'kpn', 'bapak', 'bahas', 'fiscal', 'dan', 'moneter']","['diundang', 'wapres', 'kpn', 'bapak', 'bahas', 'fiscal', 'moneter']","['undang', 'wapres', 'kpn', 'bapak', 'bahas', 'fiscal', 'moneter']"
smg sehat slalu pak menkeusmg tdk ada hubx dg pengejaran pengemplang pajak,smg sehat selalu bapak menkeusmg tidak ada hubx dengan pengejaran pengemplang pajak,"['smg', 'sehat', 'selalu', 'bapak', 'menkeusmg', 'tidak', 'ada', 'hubx', 'dengan', 'pengejaran', 'pengemplang', 'pajak']","['smg', 'sehat', 'selalu', 'bapak', 'menkeusmg', 'tidak', 'hubx', 'pengejaran', 'pengemplang', 'pajak']","['smg', 'sehat', 'selalu', 'bapak', 'menkeusmg', 'tidak', 'hubx', 'kejar', 'kemplang', 'pajak']"
wapres diajak gak pak,wapres diajak tidak bapak,"['wapres', 'diajak', 'tidak', 'bapak']","['wapres', 'diajak', 'tidak', 'bapak']","['wapres', 'ajak', 'tidak', 'bapak']"
turunkan cukai rokok pak,turunkan cukai rokok bapak,"['turunkan', 'cukai', 'rokok', 'bapak']","['turunkan', 'cukai', 'rokok', 'bapak']","['turun', 'cukai', 'rokok', 'bapak']"
bagus pak ,bagus bapak,"['bagus', 'bapak']","['bagus', 'bapak']","['bagus', 'bapak']"
waduh terlalu jujur sih bapaknya,aduh terlalu jujur sih bapaknya,"['aduh', 'terlalu', 'jujur', 'sih', 'bapaknya']","['aduh', 'terlalu', 'jujur', 'sih', 'bapaknya']","['aduh', 'terlalu', 'jujur', 'sih', 'bapak']"
real anda diminta menghadap presiden,nyata kamu diminta menghadap presiden,"['nyata', 'kamu', 'diminta', 'menghadap', 'presiden']","['nyata', 'kamu', 'diminta', 'menghadap', 'presiden']","['nyata', 'kamu', 'minta', 'hadap', 'presiden']"
ikut pak ,ikut bapak,"['ikut', 'bapak']","['ikut', 'bapak']","['ikut', 'bapak']"
kalau begitu saya makan dulu,kalau begitu aku makan dulu,"['kalau', 'begitu', 'aku', 'makan', 'dulu']","['kalau', 'aku', 'makan', 'dulu']","['kalau', 'aku', 'makan', 'dulu']"
mudahmudahan masakanya matang ,mudahmudahan masakanya matang,"['mudahmudahan', 'masakanya', 'matang']","['mudahmudahan', 'masakanya', 'matang']","['mudahmudahan', 'masakanya', 'matang']"
mukbang mbg ya pak,mukbang mbg ya bapak,"['mukbang', 'mbg', 'ya', 'bapak']","['mukbang', 'mbg', 'bapak']","['mukbang', 'mbg', 'bapak']"
diundang wapres kapan yak bahas gren inflation,diundang wapres kapan ya bahas gren inflation,"['diundang', 'wapres', 'kapan', 'ya', 'bahas', 'gren', 'inflation']","['diundang', 'wapres', 'kapan', 'bahas', 'gren', 'inflation']","['undang', 'wapres', 'kapan', 'bahas', 'gren', 'inflation']"
udah bener si baya ini,sudah benar si baya ini,"['sudah', 'benar', 'si', 'baya', 'ini']","['benar', 'si', 'baya']","['benar', 'si', 'baya']"
sudah jangan diliput mulu biarkan bekerja dengan tenang saya malah kasian,sudah jangan diliput selalu biarkan bekerja dengan tenang aku malah kasihan,"['sudah', 'jangan', 'diliput', 'selalu', 'biarkan', 'bekerja', 'dengan', 'tenang', 'aku', 'malah', 'kasihan']","['jangan', 'diliput', 'selalu', 'biarkan', 'bekerja', 'tenang', 'aku', 'malah', 'kasihan']","['jangan', 'liput', 'selalu', 'biar', 'kerja', 'tenang', 'aku', 'malah', 'kasihan']"
kebagian mbg juga bapak satu ini,kebagian mbg juga bapak satu ini,"['kebagian', 'mbg', 'juga', 'bapak', 'satu', 'ini']","['kebagian', 'mbg', 'bapak', 'satu']","['bagi', 'mbg', 'bapak', 'satu']"
klau pejabat kyk bgini d gaji tingi tdk masalah sih sesuai kinerja dn kasipitas ny,kalau pejabat seperti bgini di gaji tingi tidak masalah sih sesuai kinerja dan kasipitas nya,"['kalau', 'pejabat', 'seperti', 'bgini', 'di', 'gaji', 'tingi', 'tidak', 'masalah', 'sih', 'sesuai', 'kinerja', 'dan', 'kasipitas', 'nya']","['kalau', 'pejabat', 'bgini', 'gaji', 'tingi', 'tidak', 'masalah', 'sih', 'sesuai', 'kinerja', 'kasipitas', 'nya']","['kalau', 'jabat', 'bgini', 'gaji', 'tingi', 'tidak', 'masalah', 'sih', 'sesuai', 'kerja', 'kasipitas', 'nya']"
pakan menu mbg dari jabar ,pakan menu mbg dari jabar,"['pakan', 'menu', 'mbg', 'dari', 'jabar']","['pakan', 'menu', 'mbg', 'jabar']","['pakan', 'menu', 'mbg', 'jabar']"
ati pak kawatir ada yg bisikin dgn isue miring semoga semua berjalan dgn baik,ati bapak kawatir ada yang bisikin dengan isue miring semoga semua berjalan dengan baik,"['ati', 'bapak', 'kawatir', 'ada', 'yang', 'bisikin', 'dengan', 'isue', 'miring', 'semoga', 'semua', 'berjalan', 'dengan', 'baik']","['ati', 'bapak', 'kawatir', 'bisikin', 'isue', 'miring', 'semoga', 'semua', 'berjalan', 'baik']","['ati', 'bapak', 'kawatir', 'bisikin', 'isue', 'miring', 'moga', 'semua', 'jalan', 'baik']"
wow hebat banget ,wow hebat sekali,"['wow', 'hebat', 'sekali']","['wow', 'hebat', 'sekali']","['wow', 'hebat', 'sekali']"
sepertinya tidak lama jadi menteri karena kebijakanya sangat pro rakyat,sepertinya tidak lama jadi menteri karena kebijakanya sangat pro rakyat,"['sepertinya', 'tidak', 'lama', 'jadi', 'menteri', 'karena', 'kebijakanya', 'sangat', 'pro', 'rakyat']","['sepertinya', 'tidak', 'lama', 'jadi', 'menteri', 'kebijakanya', 'sangat', 'pro', 'rakyat']","['seperti', 'tidak', 'lama', 'jadi', 'menteri', 'kebijakanya', 'sangat', 'pro', 'rakyat']"
d undang utk memasak ,di undang untuk memasak,"['di', 'undang', 'untuk', 'memasak']","['undang', 'memasak']","['undang', 'masak']"
makan siangnya gratis gk pak nanti malah keracunan,makan siangnya gratis tidak bapak nanti malah keracunan,"['makan', 'siangnya', 'gratis', 'tidak', 'bapak', 'nanti', 'malah', 'keracunan']","['makan', 'siangnya', 'gratis', 'tidak', 'bapak', 'malah', 'keracunan']","['makan', 'siang', 'gratis', 'tidak', 'bapak', 'malah', 'racun']"
jgn mkn udang yg terkontaminasi radio aktif ya pak,jangan makan udang yang terkontaminasi radio aktif ya bapak,"['jangan', 'makan', 'udang', 'yang', 'terkontaminasi', 'radio', 'aktif', 'ya', 'bapak']","['jangan', 'makan', 'udang', 'terkontaminasi', 'radio', 'aktif', 'bapak']","['jangan', 'makan', 'udang', 'kontaminasi', 'radio', 'aktif', 'bapak']"
hajar mereka pak ,hajar mereka bapak,"['hajar', 'mereka', 'bapak']","['hajar', 'bapak']","['hajar', 'bapak']"
makanya jangan terlalu nge gas pak santai aja biarkan netizen menikmati sepak terjang dirimu di konoha kalau pejabat terlalu nge gas biasanya populer nya gak lama,makanya jangan terlalu nge gas bapak santai saja biarkan netizen menikmati sepak terjang dirimu di konoha kalau pejabat terlalu nge gas biasanya populer nya tidak lama,"['makanya', 'jangan', 'terlalu', 'nge', 'gas', 'bapak', 'santai', 'saja', 'biarkan', 'netizen', 'menikmati', 'sepak', 'terjang', 'dirimu', 'di', 'konoha', 'kalau', 'pejabat', 'terlalu', 'nge', 'gas', 'biasanya', 'populer', 'nya', 'tidak', 'lama']","['makanya', 'jangan', 'terlalu', 'nge', 'gas', 'bapak', 'santai', 'biarkan', 'netizen', 'menikmati', 'sepak', 'terjang', 'dirimu', 'konoha', 'kalau', 'pejabat', 'terlalu', 'nge', 'gas', 'biasanya', 'populer', 'nya', 'tidak', 'lama']","['makanya', 'jangan', 'terlalu', 'nge', 'gas', 'bapak', 'santai', 'biar', 'netizen', 'nikmat', 'sepak', 'terjang', 'diri', 'konoha', 'kalau', 'jabat', 'terlalu', 'nge', 'gas', 'biasa', 'populer', 'nya', 'tidak', 'lama']"
entah knp utk berita dan kasus ini mengenay bea dan cukay sy kurang percaya klo harus menteri keuangan yg tangani i mean ya keluar jalur aja itu kayak bukan job utamanya maf ini pendapat sy saja klo kerjan bgni di borong jg takutnya yg lain makan gaji buta,entah kenapa untuk berita dan kasus ini mengenay bea dan cukay sy kurang percaya kalau harus menteri keuangan yang tangani i mean ya keluar jalur saja itu seperti bukan pekerjaan utamanya maf ini pendapat sy saja kalau kerjan bgni di borong juga takutnya yang lain makan gaji buta,"['entah', 'kenapa', 'untuk', 'berita', 'dan', 'kasus', 'ini', 'mengenay', 'bea', 'dan', 'cukay', 'sy', 'kurang', 'percaya', 'kalau', 'harus', 'menteri', 'keuangan', 'yang', 'tangani', 'i', 'mean', 'ya', 'keluar', 'jalur', 'saja', 'itu', 'seperti', 'bukan', 'pekerjaan', 'utamanya', 'maf', 'ini', 'pendapat', 'sy', 'saja', 'kalau', 'kerjan', 'bgni', 'di', 'borong', 'juga', 'takutnya', 'yang', 'lain', 'makan', 'gaji', 'buta']","['entah', 'berita', 'kasus', 'mengenay', 'bea', 'cukay', 'sy', 'kurang', 'percaya', 'kalau', 'menteri', 'keuangan', 'tangani', 'i', 'mean', 'keluar', 'jalur', 'bukan', 'pekerjaan', 'utamanya', 'maf', 'pendapat', 'sy', 'kalau', 'kerjan', 'bgni', 'borong', 'takutnya', 'makan', 'gaji', 'buta']","['entah', 'berita', 'kasus', 'mengenay', 'bea', 'cukay', 'sy', 'kurang', 'percaya', 'kalau', 'menteri', 'uang', 'tangan', 'i', 'mean', 'keluar', 'jalur', 'bukan', 'kerja', 'utama', 'maf', 'dapat', 'sy', 'kalau', 'kerjan', 'bgni', 'borong', 'takut', 'makan', 'gaji', 'buta']"
let him cok ,let him jancuk,"['let', 'him', 'jancuk']","['let', 'him', 'jancuk']","['let', 'him', 'jancuk']"
bnyk yg ga baca isi utuh beritanya ini lah gambaran,banyak yang tidak baca isi utuh beritanya ini lah gambaran,"['banyak', 'yang', 'tidak', 'baca', 'isi', 'utuh', 'beritanya', 'ini', 'lah', 'gambaran']","['banyak', 'tidak', 'baca', 'isi', 'utuh', 'beritanya', 'lah', 'gambaran']","['banyak', 'tidak', 'baca', 'isi', 'utuh', 'berita', 'lah', 'gambar']"
sepatu alas kaki import tanpa bayar bea masuk juga harus di berantas dan di batasi sehinga umkm lokal serta pengrajin usaha padat karya bisa menghidupi menampung para pekerja lokal sehinga tidak mati suri dan pengabpengab seperti sekarang ini pak menteri keuangan terimakasih ,sepatu alas kaki import tanpa bayar bea masuk juga harus di berantas dan di batasi sehinga umkm lokal serta pengrajin usaha padat karya bisa menghidupi menampung para pekerja lokal sehinga tidak mati suri dan pengabpengab seperti sekarang ini bapak menteri keuangan terimakasih,"['sepatu', 'alas', 'kaki', 'import', 'tanpa', 'bayar', 'bea', 'masuk', 'juga', 'harus', 'di', 'berantas', 'dan', 'di', 'batasi', 'sehinga', 'umkm', 'lokal', 'serta', 'pengrajin', 'usaha', 'padat', 'karya', 'bisa', 'menghidupi', 'menampung', 'para', 'pekerja', 'lokal', 'sehinga', 'tidak', 'mati', 'suri', 'dan', 'pengabpengab', 'seperti', 'sekarang', 'ini', 'bapak', 'menteri', 'keuangan', 'terimakasih']","['sepatu', 'alas', 'kaki', 'import', 'bayar', 'bea', 'masuk', 'berantas', 'batasi', 'sehinga', 'umkm', 'lokal', 'pengrajin', 'usaha', 'padat', 'karya', 'menghidupi', 'menampung', 'pekerja', 'lokal', 'sehinga', 'tidak', 'mati', 'suri', 'pengabpengab', 'sekarang', 'bapak', 'menteri', 'keuangan', 'terimakasih']","['sepatu', 'alas', 'kaki', 'import', 'bayar', 'bea', 'masuk', 'berantas', 'batas', 'sehinga', 'umkm', 'lokal', 'rajin', 'usaha', 'padat', 'karya', 'hidup', 'tampung', 'kerja', 'lokal', 'sehinga', 'tidak', 'mati', 'suri', 'pengabpengab', 'sekarang', 'bapak', 'menteri', 'uang', 'terimakasih']"
yg terekam ctv lg kebakaran jengot nih,yang terekam ctv lagi kebakaran jengot ini,"['yang', 'terekam', 'ctv', 'lagi', 'kebakaran', 'jengot', 'ini']","['terekam', 'ctv', 'kebakaran', 'jengot']","['rekam', 'ctv', 'bakar', 'jengot']"
dispenda klo seragaman yg mirip ngomong masalah pajak,dispenda kalau seragaman yang mirip ngomong masalah pajak,"['dispenda', 'kalau', 'seragaman', 'yang', 'mirip', 'ngomong', 'masalah', 'pajak']","['dispenda', 'kalau', 'seragaman', 'mirip', 'ngomong', 'masalah', 'pajak']","['dispenda', 'kalau', 'seragam', 'mirip', 'ngomong', 'masalah', 'pajak']"
gentle benar katakan benar salah katakan salah semoga tuhan selalu memberkati bapak dan keluarga,gentle benar katakan benar salah katakan salah semoga tuhan selalu memberkati bapak dan keluarga,"['gentle', 'benar', 'katakan', 'benar', 'salah', 'katakan', 'salah', 'semoga', 'tuhan', 'selalu', 'memberkati', 'bapak', 'dan', 'keluarga']","['gentle', 'benar', 'katakan', 'benar', 'salah', 'katakan', 'salah', 'semoga', 'tuhan', 'selalu', 'memberkati', 'bapak', 'keluarga']","['gentle', 'benar', 'kata', 'benar', 'salah', 'kata', 'salah', 'moga', 'tuhan', 'selalu', 'kati', 'bapak', 'keluarga']"
panik ga tuh pak bc ,panik tidak itu bapak bc,"['panik', 'tidak', 'itu', 'bapak', 'bc']","['panik', 'tidak', 'bapak', 'bc']","['panik', 'tidak', 'bapak', 'bc']"
ternyata bukan pejabat bea cukai kasian udah dibuly semesta,ternyata bukan pejabat bea cukai kasihan sudah dibuly semesta,"['ternyata', 'bukan', 'pejabat', 'bea', 'cukai', 'kasihan', 'sudah', 'dibuly', 'semesta']","['ternyata', 'bukan', 'pejabat', 'bea', 'cukai', 'kasihan', 'dibuly', 'semesta']","['nyata', 'bukan', 'jabat', 'bea', 'cukai', 'kasihan', 'dibuly', 'semesta']"
