cleaned_comment,slang_replaced_comment,tekonized_comment,no_stopwords_comment,stemmed_comment
jangan di banding bandingkan mending kita suport mentri yang kerjanya bagus jgnbikin opini buruk bagi yang sudah baik suportaja yang sekarsng lagi kerja dan awasi emang kita sebagai manusia mau di banding bandingi emang paling enak itu menilai org lain tplupa nilai sendiri keduanya bagus yangsudah ya sudah ga bisa dinulang jd kan pelajaran kita focus sama yang lagi kerja aja ,jangan di banding bandingkan mending kita suport mentri yang kerjanya bagus jgnbikin opini buruk bagi yang sudah baik suportaja yang sekarsng lagi kerja dan awasi memang kita sebagai manusia mau di banding bandingi memang paling enak itu menilai orang lain tplupa nilai sendiri keduanya bagus yangsudah ya sudah tidak bisa dinulang jd kan pelajaran kita fokus sama yang lagi kerja saja,"['jangan', 'di', 'banding', 'bandingkan', 'mending', 'kita', 'suport', 'mentri', 'yang', 'kerjanya', 'bagus', 'jgnbikin', 'opini', 'buruk', 'bagi', 'yang', 'sudah', 'baik', 'suportaja', 'yang', 'sekarsng', 'lagi', 'kerja', 'dan', 'awasi', 'memang', 'kita', 'sebagai', 'manusia', 'mau', 'di', 'banding', 'bandingi', 'memang', 'paling', 'enak', 'itu', 'menilai', 'orang', 'lain', 'tplupa', 'nilai', 'sendiri', 'keduanya', 'bagus', 'yangsudah', 'ya', 'sudah', 'tidak', 'bisa', 'dinulang', 'jd', 'kan', 'pelajaran', 'kita', 'fokus', 'sama', 'yang', 'lagi', 'kerja', 'saja']","['jangan', 'banding', 'bandingkan', 'mending', 'suport', 'mentri', 'kerjanya', 'bagus', 'jgnbikin', 'opini', 'buruk', 'baik', 'suportaja', 'sekarsng', 'kerja', 'awasi', 'memang', 'manusia', 'mau', 'banding', 'bandingi', 'memang', 'paling', 'enak', 'menilai', 'orang', 'tplupa', 'nilai', 'sendiri', 'keduanya', 'bagus', 'yangsudah', 'tidak', 'dinulang', 'jd', 'kan', 'pelajaran', 'fokus', 'sama', 'kerja']","['jangan', 'banding', 'banding', 'mending', 'suport', 'tri', 'kerja', 'bagus', 'jgnbikin', 'opini', 'buruk', 'baik', 'suportaja', 'sekarsng', 'kerja', 'awas', 'memang', 'manusia', 'mau', 'banding', 'banding', 'memang', 'paling', 'enak', 'nilai', 'orang', 'tplupa', 'nilai', 'sendiri', 'dua', 'bagus', 'yangsudah', 'tidak', 'dinulang', 'jd', 'kan', 'ajar', 'fokus', 'sama', 'kerja']"
view hiden coments,view hiden coments,"['view', 'hiden', 'coments']","['view', 'hiden', 'coments']","['view', 'hiden', 'coments']"
sri mulyani is a legend purbaya cant beat her,sri mulyani adalah a legend purbaya cant beat her,"['sri', 'mulyani', 'adalah', 'a', 'legend', 'purbaya', 'cant', 'beat', 'her']","['sri', 'mulyani', 'a', 'legend', 'purbaya', 'cant', 'beat', 'her']","['sri', 'mulyani', 'a', 'legend', 'purbaya', 'cant', 'beat', 'her']"
bukan kuliah nyatapi wawasan ilmu nya yg di perlukan,bukan kuliah nyatapi wawasan ilmu nya yang di perlukan,"['bukan', 'kuliah', 'nyatapi', 'wawasan', 'ilmu', 'nya', 'yang', 'di', 'perlukan']","['bukan', 'kuliah', 'nyatapi', 'wawasan', 'ilmu', 'nya', 'perlukan']","['bukan', 'kuliah', 'nyatapi', 'wawas', 'ilmu', 'nya', 'perlu']"
dulu itb itu fakultas teknik ui,dulu itb itu fakultas teknik ui,"['dulu', 'itb', 'itu', 'fakultas', 'teknik', 'ui']","['dulu', 'itb', 'fakultas', 'teknik', 'ui']","['dulu', 'itb', 'fakultas', 'teknik', 'ui']"
orang teknik emang bisa masok semua karna itulah semasa kuliah kita digejrot abis abisan biar bisa hadepin dunia sesunguhnya diluaran sana,orang teknik memang bisa masok semua karena itulah semasa kuliah kita digejrot habis habis biar bisa hadepin dunia sesunguhnya diluaran sana,"['orang', 'teknik', 'memang', 'bisa', 'masok', 'semua', 'karena', 'itulah', 'semasa', 'kuliah', 'kita', 'digejrot', 'habis', 'habis', 'biar', 'bisa', 'hadepin', 'dunia', 'sesunguhnya', 'diluaran', 'sana']","['orang', 'teknik', 'memang', 'masok', 'semua', 'semasa', 'kuliah', 'digejrot', 'habis', 'habis', 'biar', 'hadepin', 'dunia', 'sesunguhnya', 'diluaran', 'sana']","['orang', 'teknik', 'memang', 'masok', 'semua', 'masa', 'kuliah', 'digejrot', 'habis', 'habis', 'biar', 'hadepin', 'dunia', 'sesunguhnya', 'luar', 'sana']"
wapres kita denger dr united kingdom min coba bedah ,wapres kita dengar dari united kingdom admin coba bedah,"['wapres', 'kita', 'dengar', 'dari', 'united', 'kingdom', 'admin', 'coba', 'bedah']","['wapres', 'dengar', 'united', 'kingdom', 'admin', 'coba', 'bedah']","['wapres', 'dengar', 'united', 'kingdom', 'admin', 'coba', 'bedah']"
sri cekek rakyat doang kerjanya,sri cekek rakyat doang kerjanya,"['sri', 'cekek', 'rakyat', 'doang', 'kerjanya']","['sri', 'cekek', 'rakyat', 'doang', 'kerjanya']","['sri', 'cekek', 'rakyat', 'doang', 'kerja']"
anak saya sat ini masih kuliah di purdue university untuk international student masuk nya tidak mudah,anak aku sat ini masih kuliah di purdue universitas untuk internasional siswa masuk nya tidak mudah,"['anak', 'aku', 'sat', 'ini', 'masih', 'kuliah', 'di', 'purdue', 'universitas', 'untuk', 'internasional', 'siswa', 'masuk', 'nya', 'tidak', 'mudah']","['anak', 'aku', 'sat', 'kuliah', 'purdue', 'universitas', 'internasional', 'siswa', 'masuk', 'nya', 'tidak', 'mudah']","['anak', 'aku', 'sat', 'kuliah', 'purdue', 'universitas', 'internasional', 'siswa', 'masuk', 'nya', 'tidak', 'mudah']"
dua dua nya bagus ,dua dua nya bagus,"['dua', 'dua', 'nya', 'bagus']","['nya', 'bagus']","['nya', 'bagus']"
nah harusnya level menteri begini jgn mantan sopir angkot dijadin menteri,nah harusnya level menteri begini jangan mantan sopir angkot dijadin menteri,"['nah', 'harusnya', 'level', 'menteri', 'begini', 'jangan', 'mantan', 'sopir', 'angkot', 'dijadin', 'menteri']","['nah', 'harusnya', 'level', 'menteri', 'begini', 'jangan', 'mantan', 'sopir', 'angkot', 'dijadin', 'menteri']","['nah', 'harus', 'level', 'menteri', 'begini', 'jangan', 'mantan', 'sopir', 'angkot', 'dijadin', 'menteri']"
andai dulu bapak tidak melarang saya masuk elektro udah bisa jd mentri kali ya,andai dulu bapak tidak melarang aku masuk elektro sudah bisa jd mentri kali ya,"['andai', 'dulu', 'bapak', 'tidak', 'melarang', 'aku', 'masuk', 'elektro', 'sudah', 'bisa', 'jd', 'mentri', 'kali', 'ya']","['andai', 'dulu', 'bapak', 'tidak', 'melarang', 'aku', 'masuk', 'elektro', 'jd', 'mentri', 'kali']","['andai', 'dulu', 'bapak', 'tidak', 'larang', 'aku', 'masuk', 'elektro', 'jd', 'tri', 'kali']"
saya fans pak purbaya satnya beliau berbenah struktur ekonomi dan keuangan yg sudah rusak,aku fans bapak purbaya satnya beliau berbenah struktur ekonomi dan keuangan yang sudah rusak,"['aku', 'fans', 'bapak', 'purbaya', 'satnya', 'beliau', 'berbenah', 'struktur', 'ekonomi', 'dan', 'keuangan', 'yang', 'sudah', 'rusak']","['aku', 'fans', 'bapak', 'purbaya', 'satnya', 'beliau', 'berbenah', 'struktur', 'ekonomi', 'keuangan', 'rusak']","['aku', 'fans', 'bapak', 'purbaya', 'sat', 'beliau', 'benah', 'struktur', 'ekonomi', 'uang', 'rusak']"
bu sri mulyani tetep keren sih meskipun memang kebijakan akhir akhir aja yg di sorot padahal kalo gada beliau mungkin kita sampe sat ini gk kan kenal yg namanya qris yang udah diakui sistem keuangan digital terbaik dan sampe ditakutkan us pula,ibu sri mulyani tetap keren sih meskipun memang kebijakan akhir akhir saja yang di sorot padahal kalau tidak ada beliau mungkin kita sampai sat ini tidak kan kenal yang namanya qris yang sudah diakui sistem keuangan digital terbaik dan sampai ditakutkan kami pula,"['ibu', 'sri', 'mulyani', 'tetap', 'keren', 'sih', 'meskipun', 'memang', 'kebijakan', 'akhir', 'akhir', 'saja', 'yang', 'di', 'sorot', 'padahal', 'kalau', 'tidak', 'ada', 'beliau', 'mungkin', 'kita', 'sampai', 'sat', 'ini', 'tidak', 'kan', 'kenal', 'yang', 'namanya', 'qris', 'yang', 'sudah', 'diakui', 'sistem', 'keuangan', 'digital', 'terbaik', 'dan', 'sampai', 'ditakutkan', 'kami', 'pula']","['ibu', 'sri', 'mulyani', 'tetap', 'keren', 'sih', 'meskipun', 'memang', 'kebijakan', 'akhir', 'akhir', 'sorot', 'padahal', 'kalau', 'tidak', 'beliau', 'mungkin', 'sat', 'tidak', 'kan', 'kenal', 'namanya', 'qris', 'diakui', 'sistem', 'keuangan', 'digital', 'terbaik', 'ditakutkan']","['ibu', 'sri', 'mulyani', 'tetap', 'keren', 'sih', 'meski', 'memang', 'bijak', 'akhir', 'akhir', 'sorot', 'padahal', 'kalau', 'tidak', 'beliau', 'mungkin', 'sat', 'tidak', 'kan', 'kenal', 'nama', 'qris', 'aku', 'sistem', 'uang', 'digital', 'baik', 'takut']"
cv nya,cv nya,"['cv', 'nya']","['cv', 'nya']","['cv', 'nya']"
jujur aja ya mang perempuan itu ga kalah berkualitas dari pada laki tapi kalo urusan kenegaran aku lebih memilih lakiyg ngatur,jujur saja ya mang perempuan itu tidak kalah berkualitas dari pada laki tapi kalau urusan kenegaran aku lebih memilih lakiyg ngatur,"['jujur', 'saja', 'ya', 'mang', 'perempuan', 'itu', 'tidak', 'kalah', 'berkualitas', 'dari', 'pada', 'laki', 'tapi', 'kalau', 'urusan', 'kenegaran', 'aku', 'lebih', 'memilih', 'lakiyg', 'ngatur']","['jujur', 'mang', 'perempuan', 'tidak', 'kalah', 'berkualitas', 'laki', 'kalau', 'urusan', 'kenegaran', 'aku', 'lebih', 'memilih', 'lakiyg', 'ngatur']","['jujur', 'mang', 'perempuan', 'tidak', 'kalah', 'kualitas', 'laki', 'kalau', 'urus', 'kenegaran', 'aku', 'lebih', 'pilih', 'lakiyg', 'ngatur']"
mending pak ahok aja yg jadi menkeu,mending bapak ahok saja yang jadi menkeu,"['mending', 'bapak', 'ahok', 'saja', 'yang', 'jadi', 'menkeu']","['mending', 'bapak', 'ahok', 'jadi', 'menkeu']","['mending', 'bapak', 'ahok', 'jadi', 'menkeu']"
yang rakyat pengen harga bahan pokok kesehatan dan pendidikan murah ,yang rakyat ingin harga bahan pokok kesehatan dan pendidikan murah,"['yang', 'rakyat', 'ingin', 'harga', 'bahan', 'pokok', 'kesehatan', 'dan', 'pendidikan', 'murah']","['rakyat', 'harga', 'bahan', 'pokok', 'kesehatan', 'pendidikan', 'murah']","['rakyat', 'harga', 'bahan', 'pokok', 'sehat', 'didik', 'murah']"
cv para pejabat dpr harus setara ini,cv para pejabat dpr harus setara ini,"['cv', 'para', 'pejabat', 'dpr', 'harus', 'setara', 'ini']","['cv', 'pejabat', 'dpr', 'setara']","['cv', 'jabat', 'dpr', 'tara']"
keren pak ,keren bapak,"['keren', 'bapak']","['keren', 'bapak']","['keren', 'bapak']"
pernah menjadi orang penting imf keren ,pernah menjadi orang penting imf keren,"['pernah', 'menjadi', 'orang', 'penting', 'imf', 'keren']","['pernah', 'menjadi', 'orang', 'penting', 'imf', 'keren']","['pernah', 'jadi', 'orang', 'penting', 'imf', 'keren']"
semoga indonesia membaik,semoga indonesia membaik,"['semoga', 'indonesia', 'membaik']","['semoga', 'indonesia', 'membaik']","['moga', 'indonesia', 'baik']"
smoga pkpur lebih baik dr sri mol,smoga pkpur lebih baik dari sri mol,"['smoga', 'pkpur', 'lebih', 'baik', 'dari', 'sri', 'mol']","['smoga', 'pkpur', 'lebih', 'baik', 'sri', 'mol']","['smoga', 'pkpur', 'lebih', 'baik', 'sri', 'mol']"
sama sama orang hebat,sama sama orang hebat,"['sama', 'sama', 'orang', 'hebat']","['sama', 'sama', 'orang', 'hebat']","['sama', 'sama', 'orang', 'hebat']"
percuma kalo gak berantas korupsi,percuma kalau tidak berantas korupsi,"['percuma', 'kalau', 'tidak', 'berantas', 'korupsi']","['percuma', 'kalau', 'tidak', 'berantas', 'korupsi']","['percuma', 'kalau', 'tidak', 'berantas', 'korupsi']"
jauh lebih ungul purbaya dari pendidikanya,jauh lebih ungul purbaya dari pendidikanya,"['jauh', 'lebih', 'ungul', 'purbaya', 'dari', 'pendidikanya']","['jauh', 'lebih', 'ungul', 'purbaya', 'pendidikanya']","['jauh', 'lebih', 'ungul', 'purbaya', 'kanya']"
purbaya peneliti jurnal nya mana,purbaya peneliti jurnal nya mana,"['purbaya', 'peneliti', 'jurnal', 'nya', 'mana']","['purbaya', 'peneliti', 'jurnal', 'nya', 'mana']","['purbaya', 'teliti', 'jurnal', 'nya', 'mana']"
bu sri mulyani mereka berdua keren bgt,ibu sri mulyani mereka berdua keren sekali,"['ibu', 'sri', 'mulyani', 'mereka', 'berdua', 'keren', 'sekali']","['ibu', 'sri', 'mulyani', 'berdua', 'keren', 'sekali']","['ibu', 'sri', 'mulyani', 'dua', 'keren', 'sekali']"
yg penting keberpihakan kepada rakyat bukan ke asing,yang penting keberpihakan kepada rakyat bukan ke asing,"['yang', 'penting', 'keberpihakan', 'kepada', 'rakyat', 'bukan', 'ke', 'asing']","['penting', 'keberpihakan', 'rakyat', 'bukan', 'asing']","['penting', 'pihak', 'rakyat', 'bukan', 'asing']"
transparansi angaran apan kocak,transparansi angaran apan kocak,"['transparansi', 'angaran', 'apan', 'kocak']","['transparansi', 'angaran', 'apan', 'kocak']","['transparansi', 'angaran', 'apan', 'kocak']"
kartini jaman now ,kartini zaman now,"['kartini', 'zaman', 'now']","['kartini', 'zaman', 'now']","['kartini', 'zaman', 'now']"
mulyani terlalu defensif g cocok untuk negara berkembang cuma mau cari aman,mulyani terlalu defensif tidak cocok untuk negara berkembang hanya mau cari aman,"['mulyani', 'terlalu', 'defensif', 'tidak', 'cocok', 'untuk', 'negara', 'berkembang', 'hanya', 'mau', 'cari', 'aman']","['mulyani', 'terlalu', 'defensif', 'tidak', 'cocok', 'negara', 'berkembang', 'mau', 'cari', 'aman']","['mulyani', 'terlalu', 'defensif', 'tidak', 'cocok', 'negara', 'kembang', 'mau', 'cari', 'aman']"
bu sri udh bnyak bgt jasanya ,ibu sri sudah bnyak sekali jasanya,"['ibu', 'sri', 'sudah', 'bnyak', 'sekali', 'jasanya']","['ibu', 'sri', 'bnyak', 'sekali', 'jasanya']","['ibu', 'sri', 'bnyak', 'sekali', 'jasa']"
menyala pak pur ,menyala bapak pur,"['menyala', 'bapak', 'pur']","['menyala', 'bapak', 'pur']","['nyala', 'bapak', 'pur']"
purbaya ,purbaya,['purbaya'],['purbaya'],['purbaya']
serius penasaran kalo wapres kita lulusan mana ya terakhir,serius penasaran kalau wapres kita lulusan mana ya terakhir,"['serius', 'penasaran', 'kalau', 'wapres', 'kita', 'lulusan', 'mana', 'ya', 'terakhir']","['serius', 'penasaran', 'kalau', 'wapres', 'lulusan', 'mana', 'terakhir']","['serius', 'penasaran', 'kalau', 'wapres', 'lulus', 'mana', 'akhir']"
liat aja dulu hasil kerja nya jgan puja puji atau hujat dulu liat nti raport nya ,lihat saja dulu hasil kerja nya jgan puja puji atau hujat dulu lihat nanti raport nya,"['lihat', 'saja', 'dulu', 'hasil', 'kerja', 'nya', 'jgan', 'puja', 'puji', 'atau', 'hujat', 'dulu', 'lihat', 'nanti', 'raport', 'nya']","['lihat', 'dulu', 'hasil', 'kerja', 'nya', 'jgan', 'puja', 'puji', 'hujat', 'dulu', 'lihat', 'raport', 'nya']","['lihat', 'dulu', 'hasil', 'kerja', 'nya', 'jgan', 'puja', 'puji', 'hujat', 'dulu', 'lihat', 'raport', 'nya']"
keduanya keren beda style aja min main goalnya sama tentunya untuk meningkatkan dan nguatin economy indo,keduanya keren beda style saja admin main goalnya sama tentunya untuk meningkatkan dan nguatin economy indonesia,"['keduanya', 'keren', 'beda', 'style', 'saja', 'admin', 'main', 'goalnya', 'sama', 'tentunya', 'untuk', 'meningkatkan', 'dan', 'nguatin', 'economy', 'indonesia']","['keduanya', 'keren', 'beda', 'style', 'admin', 'main', 'goalnya', 'sama', 'tentunya', 'meningkatkan', 'nguatin', 'economy', 'indonesia']","['dua', 'keren', 'beda', 'style', 'admin', 'main', 'goalnya', 'sama', 'tentu', 'tingkat', 'nguatin', 'economy', 'indonesia']"
andaikan orang berilmu di atas sana tidak mengunakan ilmunya untuk memperdaya masyarakat banyak niscaya ilmunya akan bermanfat dunia akhirat,andaikan orang berilmu di atas sana tidak mengunakan ilmunya untuk memperdaya masyarakat banyak niscaya ilmunya akan bermanfat dunia akhirat,"['andaikan', 'orang', 'berilmu', 'di', 'atas', 'sana', 'tidak', 'mengunakan', 'ilmunya', 'untuk', 'memperdaya', 'masyarakat', 'banyak', 'niscaya', 'ilmunya', 'akan', 'bermanfat', 'dunia', 'akhirat']","['andaikan', 'orang', 'berilmu', 'atas', 'sana', 'tidak', 'mengunakan', 'ilmunya', 'memperdaya', 'masyarakat', 'banyak', 'niscaya', 'ilmunya', 'bermanfat', 'dunia', 'akhirat']","['andai', 'orang', 'beril', 'atas', 'sana', 'tidak', 'mengunakan', 'ilmu', 'daya', 'masyarakat', 'banyak', 'niscaya', 'ilmu', 'bermanfat', 'dunia', 'akhirat']"
menteri aja beroendidikan masa wakil presiden tamat sma benar kah dan tampangnya mau tdr terus mukanya,menteri saja beroendidikan masa wakil presiden tamat sma benar kah dan tampangnya mau tidur terus mukanya,"['menteri', 'saja', 'beroendidikan', 'masa', 'wakil', 'presiden', 'tamat', 'sma', 'benar', 'kah', 'dan', 'tampangnya', 'mau', 'tidur', 'terus', 'mukanya']","['menteri', 'beroendidikan', 'masa', 'wakil', 'presiden', 'tamat', 'sma', 'benar', 'tampangnya', 'mau', 'tidur', 'terus', 'mukanya']","['menteri', 'beroendidikan', 'masa', 'wakil', 'presiden', 'tamat', 'sma', 'benar', 'tampang', 'mau', 'tidur', 'terus', 'muka']"
kalo pengalaman fiskal masih jauh dgn sm,kalau pengalaman fiskal masih jauh dengan sama,"['kalau', 'pengalaman', 'fiskal', 'masih', 'jauh', 'dengan', 'sama']","['kalau', 'pengalaman', 'fiskal', 'jauh', 'sama']","['kalau', 'alam', 'fiskal', 'jauh', 'sama']"
berbeda lah lebih keren ibu sri dari dasar basicnya juga udah ekonomi dari dulu,berbeda lah lebih keren ibu sri dari dasar basicnya juga sudah ekonomi dari dulu,"['berbeda', 'lah', 'lebih', 'keren', 'ibu', 'sri', 'dari', 'dasar', 'basicnya', 'juga', 'sudah', 'ekonomi', 'dari', 'dulu']","['berbeda', 'lah', 'lebih', 'keren', 'ibu', 'sri', 'dasar', 'basicnya', 'ekonomi', 'dulu']","['beda', 'lah', 'lebih', 'keren', 'ibu', 'sri', 'dasar', 'basicnya', 'ekonomi', 'dulu']"
pernah merintis di swasta dan dari bawah pernahlah ya di real busines semoga lebih baik ,pernah merintis di swasta dan dari bawah pernahlah ya di nyata busines semoga lebih baik,"['pernah', 'merintis', 'di', 'swasta', 'dan', 'dari', 'bawah', 'pernahlah', 'ya', 'di', 'nyata', 'busines', 'semoga', 'lebih', 'baik']","['pernah', 'merintis', 'swasta', 'bawah', 'pernahlah', 'nyata', 'busines', 'semoga', 'lebih', 'baik']","['pernah', 'rintis', 'swasta', 'bawah', 'pernah', 'nyata', 'busines', 'moga', 'lebih', 'baik']"
keduanya hebatorang indonesia ,keduanya hebatorang indonesia,"['keduanya', 'hebatorang', 'indonesia']","['keduanya', 'hebatorang', 'indonesia']","['dua', 'hebatorang', 'indonesia']"
pak purbaya orgnya sahabatnya pak aniesirmul orgnya mulyonojadi tau kan siapa yg cerdas,bapak purbaya orgnya sahabatnya bapak aniesirmul orgnya mulyonojadi tau kan siapa yang cerdas,"['bapak', 'purbaya', 'orgnya', 'sahabatnya', 'bapak', 'aniesirmul', 'orgnya', 'mulyonojadi', 'tau', 'kan', 'siapa', 'yang', 'cerdas']","['bapak', 'purbaya', 'orgnya', 'sahabatnya', 'bapak', 'aniesirmul', 'orgnya', 'mulyonojadi', 'tau', 'kan', 'siapa', 'cerdas']","['bapak', 'purbaya', 'orgnya', 'sahabat', 'bapak', 'aniesirmul', 'orgnya', 'mulyonojadi', 'tau', 'kan', 'siapa', 'cerdas']"
bapak koboy gue,bapak koboy aku,"['bapak', 'koboy', 'aku']","['bapak', 'koboy', 'aku']","['bapak', 'koboy', 'aku']"
keren ,keren,['keren'],['keren'],['keren']
purbaya pemenangnya,purbaya pemenangnya,"['purbaya', 'pemenangnya']","['purbaya', 'pemenangnya']","['purbaya', 'menang']"
yakin kedepan ekonomi akan membaik,yakin kedepan ekonomi akan membaik,"['yakin', 'kedepan', 'ekonomi', 'akan', 'membaik']","['yakin', 'kedepan', 'ekonomi', 'membaik']","['yakin', 'depan', 'ekonomi', 'baik']"
semua jebolan paman sam ,semua jebolan paman sam,"['semua', 'jebolan', 'paman', 'sam']","['semua', 'jebolan', 'paman', 'sam']","['semua', 'jebol', 'paman', 'sam']"
yang punya hati utk rakyat ini yang di cari,yang punya hati untuk rakyat ini yang di cari,"['yang', 'punya', 'hati', 'untuk', 'rakyat', 'ini', 'yang', 'di', 'cari']","['punya', 'hati', 'rakyat', 'cari']","['punya', 'hati', 'rakyat', 'cari']"
 gaspol pak,gas bapak,"['gas', 'bapak']","['gas', 'bapak']","['gas', 'bapak']"
teknik elektro itb loh,teknik elektro itb loh,"['teknik', 'elektro', 'itb', 'loh']","['teknik', 'elektro', 'itb', 'loh']","['teknik', 'elektro', 'itb', 'loh']"
indonesia butuh orang jujur,indonesia butuh orang jujur,"['indonesia', 'butuh', 'orang', 'jujur']","['indonesia', 'butuh', 'orang', 'jujur']","['indonesia', 'butuh', 'orang', 'jujur']"
ilinois vs purdue adu kebijakan ekonomi dan keuangan,ilinois vs purdue adu kebijakan ekonomi dan keuangan,"['ilinois', 'vs', 'purdue', 'adu', 'kebijakan', 'ekonomi', 'dan', 'keuangan']","['ilinois', 'vs', 'purdue', 'adu', 'kebijakan', 'ekonomi', 'keuangan']","['ilinois', 'vs', 'purdue', 'adu', 'bijak', 'ekonomi', 'uang']"
terima kasih atas hutang trilyunan nya yg semakin membengkak bersaman juga dengan pertumbuhan pajak yg semakin tingi pula mis nya kemana ya hehehe,terima kasih atas hutang trilyunan nya yang semakin membengkak bersaman juga dengan pertumbuhan pajak yang semakin tingi pula mis nya kemana ya hehehe,"['terima', 'kasih', 'atas', 'hutang', 'trilyunan', 'nya', 'yang', 'semakin', 'membengkak', 'bersaman', 'juga', 'dengan', 'pertumbuhan', 'pajak', 'yang', 'semakin', 'tingi', 'pula', 'mis', 'nya', 'kemana', 'ya', 'hehehe']","['terima', 'kasih', 'atas', 'hutang', 'trilyunan', 'nya', 'semakin', 'membengkak', 'bersaman', 'pertumbuhan', 'pajak', 'semakin', 'tingi', 'mis', 'nya', 'hehehe']","['terima', 'kasih', 'atas', 'hutang', 'trilyunan', 'nya', 'makin', 'bengkak', 'saman', 'tumbuh', 'pajak', 'makin', 'tingi', 'mis', 'nya', 'hehehe']"
oalaf imf dan world bank ga heran,oalaf imf dan world bank tidak heran,"['oalaf', 'imf', 'dan', 'world', 'bank', 'tidak', 'heran']","['oalaf', 'imf', 'world', 'bank', 'tidak', 'heran']","['oalaf', 'imf', 'world', 'bank', 'tidak', 'heran']"
semuanya pendapat saya menteri pasti punyai kelebihan masih ya sebagai anak indonesia banyak bersyukur dapat menteri keuangan yang pintar saya ucapkan banyak terima kasih,semuanya pendapat aku menteri pasti punyai kelebihan masih ya sebagai anak indonesia banyak bersyukur dapat menteri keuangan yang pintar aku ucapkan banyak terima kasih,"['semuanya', 'pendapat', 'aku', 'menteri', 'pasti', 'punyai', 'kelebihan', 'masih', 'ya', 'sebagai', 'anak', 'indonesia', 'banyak', 'bersyukur', 'dapat', 'menteri', 'keuangan', 'yang', 'pintar', 'aku', 'ucapkan', 'banyak', 'terima', 'kasih']","['semuanya', 'pendapat', 'aku', 'menteri', 'punyai', 'kelebihan', 'anak', 'indonesia', 'banyak', 'bersyukur', 'menteri', 'keuangan', 'pintar', 'aku', 'ucapkan', 'banyak', 'terima', 'kasih']","['semua', 'dapat', 'aku', 'menteri', 'punya', 'lebih', 'anak', 'indonesia', 'banyak', 'syukur', 'menteri', 'uang', 'pintar', 'aku', 'ucap', 'banyak', 'terima', 'kasih']"
request wapres skrg dg wapres sebelumnya misalnya bp yusuf kala,minta wapres sekarang dengan wapres sebelumnya misalnya bp yusuf kala,"['minta', 'wapres', 'sekarang', 'dengan', 'wapres', 'sebelumnya', 'misalnya', 'bp', 'yusuf', 'kala']","['minta', 'wapres', 'sekarang', 'wapres', 'sebelumnya', 'misalnya', 'bp', 'yusuf', 'kala']","['minta', 'wapres', 'sekarang', 'wapres', 'belum', 'misal', 'bp', 'yusuf', 'kala']"
ibu sri mulyani ,ibu sri mulyani,"['ibu', 'sri', 'mulyani']","['ibu', 'sri', 'mulyani']","['ibu', 'sri', 'mulyani']"
ntar undang ke coc,nanti undang ke coc,"['nanti', 'undang', 'ke', 'coc']","['undang', 'coc']","['undang', 'coc']"
gk peduli umr msh paling kecil di dunia,tidak peduli umr masih paling kecil di dunia,"['tidak', 'peduli', 'umr', 'masih', 'paling', 'kecil', 'di', 'dunia']","['tidak', 'peduli', 'umr', 'paling', 'kecil', 'dunia']","['tidak', 'peduli', 'umr', 'paling', 'kecil', 'dunia']"
slide terakhir ngak bnget,slide terakhir tidak sekali,"['slide', 'terakhir', 'tidak', 'sekali']","['slide', 'terakhir', 'tidak', 'sekali']","['slide', 'akhir', 'tidak', 'sekali']"
min salah bahas coba bahas kasusnya jangan bahas baikbaiknya ,admin salah bahas coba bahas kasusnya jangan bahas baikbaiknya,"['admin', 'salah', 'bahas', 'coba', 'bahas', 'kasusnya', 'jangan', 'bahas', 'baikbaiknya']","['admin', 'salah', 'bahas', 'coba', 'bahas', 'kasusnya', 'jangan', 'bahas', 'baikbaiknya']","['admin', 'salah', 'bahas', 'coba', 'bahas', 'kasus', 'jangan', 'bahas', 'baikbaiknya']"
sm pengalaman banyak purbaya new comer selamat berubah,sama pengalaman banyak purbaya baru comer selamat berubah,"['sama', 'pengalaman', 'banyak', 'purbaya', 'baru', 'comer', 'selamat', 'berubah']","['sama', 'pengalaman', 'banyak', 'purbaya', 'baru', 'comer', 'selamat', 'berubah']","['sama', 'alam', 'banyak', 'purbaya', 'baru', 'comer', 'selamat', 'ubah']"
tulisan dan komparasi yang menarik terutama tag line berbeda perspektif satu misi apapun cara dan konsekuensi dalam diputuskanya kebijakan kedua menteri ini mereka tetap disatukan oleh satu tujuan yang sama: menjaga dan membangun ekonomi indonesia,tulisan dan komparasi yang menarik terutama tag line berbeda perspektif satu misi apapun cara dan konsekuensi dalam diputuskanya kebijakan kedua menteri ini mereka tetap disatukan oleh satu tujuan yang sama: menjaga dan membangun ekonomi indonesia,"['tulisan', 'dan', 'komparasi', 'yang', 'menarik', 'terutama', 'tag', 'line', 'berbeda', 'perspektif', 'satu', 'misi', 'apapun', 'cara', 'dan', 'konsekuensi', 'dalam', 'diputuskanya', 'kebijakan', 'kedua', 'menteri', 'ini', 'mereka', 'tetap', 'disatukan', 'oleh', 'satu', 'tujuan', 'yang', 'sama:', 'menjaga', 'dan', 'membangun', 'ekonomi', 'indonesia']","['tulisan', 'komparasi', 'menarik', 'terutama', 'tag', 'line', 'berbeda', 'perspektif', 'satu', 'misi', 'apapun', 'cara', 'konsekuensi', 'diputuskanya', 'kebijakan', 'kedua', 'menteri', 'tetap', 'disatukan', 'satu', 'tujuan', 'sama:', 'menjaga', 'membangun', 'ekonomi', 'indonesia']","['tulis', 'komparasi', 'tarik', 'utama', 'tag', 'line', 'beda', 'perspektif', 'satu', 'misi', 'apa', 'cara', 'konsekuensi', 'diputuskanya', 'bijak', 'dua', 'menteri', 'tetap', 'satu', 'satu', 'tuju', 'sama', 'jaga', 'bangun', 'ekonomi', 'indonesia']"
sri mulyani itu sudah gak beres sat era jokowi,sri mulyani itu sudah tidak selesai sat era jokowi,"['sri', 'mulyani', 'itu', 'sudah', 'tidak', 'selesai', 'sat', 'era', 'jokowi']","['sri', 'mulyani', 'tidak', 'selesai', 'sat', 'era', 'jokowi']","['sri', 'mulyani', 'tidak', 'selesai', 'sat', 'era', 'jokowi']"
ini yg sekolah beneran sampe lulus dpt ijasah,ini yang sekolah beneran sampai lulus dapat ijasah,"['ini', 'yang', 'sekolah', 'beneran', 'sampai', 'lulus', 'dapat', 'ijasah']","['sekolah', 'beneran', 'lulus', 'ijasah']","['sekolah', 'beneran', 'lulus', 'ijasah']"
