cleaned_comment,slang_replaced_comment,tekonized_comment,no_stopwords_comment,stemmed_comment
sri mulyani masih takut mati membela kebenaran,sri mulyani masih takut mati membela kebenaran,"['sri', 'mulyani', 'masih', 'takut', 'mati', 'membela', 'kebenaran']","['sri', 'mulyani', 'takut', 'mati', 'membela', 'kebenaran']","['sri', 'mulyani', 'takut', 'mati', 'bela', 'benar']"
mantap pak berantas semuanya,mantap bapak berantas semuanya,"['mantap', 'bapak', 'berantas', 'semuanya']","['mantap', 'bapak', 'berantas', 'semuanya']","['mantap', 'bapak', 'berantas', 'semua']"
gmn gak mati industri legalnya pita cukai naik trus rokok ilegal merajalela dan udah rahasia umum rokok ilegal ada backingan,bagaimana tidak mati industri legalnya pita cukai naik terus rokok ilegal merajalela dan sudah rahasia umum rokok ilegal ada backingan,"['bagaimana', 'tidak', 'mati', 'industri', 'legalnya', 'pita', 'cukai', 'naik', 'terus', 'rokok', 'ilegal', 'merajalela', 'dan', 'sudah', 'rahasia', 'umum', 'rokok', 'ilegal', 'ada', 'backingan']","['bagaimana', 'tidak', 'mati', 'industri', 'legalnya', 'pita', 'cukai', 'naik', 'terus', 'rokok', 'ilegal', 'merajalela', 'rahasia', 'umum', 'rokok', 'ilegal', 'backingan']","['bagaimana', 'tidak', 'mati', 'industri', 'legal', 'pita', 'cukai', 'naik', 'terus', 'rokok', 'ilegal', 'rajalela', 'rahasia', 'umum', 'rokok', 'ilegal', 'backingan']"
coba kita lihat dulu bapak purbaya ini bagaimana orang nya jangan terlalu cepat menyimpulkan karena framing media kita liat dampak ekonomi indonesia kedepan nya khususnya terhadap masyarakat golongan menengah dan golongan bawah apabila kesejahteran terasa baru bisa mengambil kesimpulan supaya kita jd orang tidak subjektif,coba kita lihat dulu bapak purbaya ini bagaimana orang nya jangan terlalu cepat menyimpulkan karena framing media kita lihat dampak ekonomi indonesia kedepan nya khususnya terhadap masyarakat golongan menengah dan golongan bawah apabila kesejahteran terasa baru bisa mengambil kesimpulan supaya kita jd orang tidak subjektif,"['coba', 'kita', 'lihat', 'dulu', 'bapak', 'purbaya', 'ini', 'bagaimana', 'orang', 'nya', 'jangan', 'terlalu', 'cepat', 'menyimpulkan', 'karena', 'framing', 'media', 'kita', 'lihat', 'dampak', 'ekonomi', 'indonesia', 'kedepan', 'nya', 'khususnya', 'terhadap', 'masyarakat', 'golongan', 'menengah', 'dan', 'golongan', 'bawah', 'apabila', 'kesejahteran', 'terasa', 'baru', 'bisa', 'mengambil', 'kesimpulan', 'supaya', 'kita', 'jd', 'orang', 'tidak', 'subjektif']","['coba', 'lihat', 'dulu', 'bapak', 'purbaya', 'bagaimana', 'orang', 'nya', 'jangan', 'terlalu', 'cepat', 'menyimpulkan', 'framing', 'media', 'lihat', 'dampak', 'ekonomi', 'indonesia', 'kedepan', 'nya', 'khususnya', 'masyarakat', 'golongan', 'menengah', 'golongan', 'bawah', 'apabila', 'kesejahteran', 'terasa', 'baru', 'mengambil', 'kesimpulan', 'jd', 'orang', 'tidak', 'subjektif']","['coba', 'lihat', 'dulu', 'bapak', 'purbaya', 'bagaimana', 'orang', 'nya', 'jangan', 'terlalu', 'cepat', 'simpul', 'framing', 'media', 'lihat', 'dampak', 'ekonomi', 'indonesia', 'depan', 'nya', 'khusus', 'masyarakat', 'golong', 'tengah', 'golong', 'bawah', 'apabila', 'kesejahteran', 'asa', 'baru', 'ambil', 'simpul', 'jd', 'orang', 'tidak', 'subjektif']"
wakti ibuk itu yg bawah lomba setoran maka tenang,wakti ibu itu yang bawah lomba setoran maka tenang,"['wakti', 'ibu', 'itu', 'yang', 'bawah', 'lomba', 'setoran', 'maka', 'tenang']","['wakti', 'ibu', 'bawah', 'lomba', 'setoran', 'tenang']","['wakti', 'ibu', 'bawah', 'lomba', 'setor', 'tenang']"
gw rasa mentri klo bersikap netral ga akan takut siapapungas trus pak,aku rasa mentri kalau bersikap netral tidak akan takut siapapungas terus bapak,"['aku', 'rasa', 'mentri', 'kalau', 'bersikap', 'netral', 'tidak', 'akan', 'takut', 'siapapungas', 'terus', 'bapak']","['aku', 'rasa', 'mentri', 'kalau', 'bersikap', 'netral', 'tidak', 'takut', 'siapapungas', 'terus', 'bapak']","['aku', 'rasa', 'tri', 'kalau', 'sikap', 'netral', 'tidak', 'takut', 'siapapungas', 'terus', 'bapak']"
semoga rokok bisa lebih murah,semoga rokok bisa lebih murah,"['semoga', 'rokok', 'bisa', 'lebih', 'murah']","['semoga', 'rokok', 'lebih', 'murah']","['moga', 'rokok', 'lebih', 'murah']"
ini mentri kelihatan meragukan di awal tapi sepertinya sepak terjangnya bagus tegas dan sat set ayo kita dukung menkeu purbaya memberantas mafia dalam sektor apapun yg merugikan negara,ini mentri kelihatan meragukan di awal tapi sepertinya sepak terjangnya bagus tegas dan sat setengah ayo kita dukung menkeu purbaya memberantas mafia dalam sektor apapun yang merugikan negara,"['ini', 'mentri', 'kelihatan', 'meragukan', 'di', 'awal', 'tapi', 'sepertinya', 'sepak', 'terjangnya', 'bagus', 'tegas', 'dan', 'sat', 'setengah', 'ayo', 'kita', 'dukung', 'menkeu', 'purbaya', 'memberantas', 'mafia', 'dalam', 'sektor', 'apapun', 'yang', 'merugikan', 'negara']","['mentri', 'kelihatan', 'meragukan', 'awal', 'sepertinya', 'sepak', 'terjangnya', 'bagus', 'tegas', 'sat', 'setengah', 'ayo', 'dukung', 'menkeu', 'purbaya', 'memberantas', 'mafia', 'sektor', 'apapun', 'merugikan', 'negara']","['tri', 'lihat', 'ragu', 'awal', 'seperti', 'sepak', 'terjang', 'bagus', 'tegas', 'sat', 'tengah', 'ayo', 'dukung', 'menkeu', 'purbaya', 'berantas', 'mafia', 'sektor', 'apa', 'rugi', 'negara']"
sri mulyani di cintai pejabat,sri mulyani di cintai pejabat,"['sri', 'mulyani', 'di', 'cintai', 'pejabat']","['sri', 'mulyani', 'cintai', 'pejabat']","['sri', 'mulyani', 'cinta', 'jabat']"
cuma bisa bantu doa semoga proses lancar penegak keadilan dan kebenaran di berikan keselamatan dan kekuatan amin ,hanya bisa bantu doa semoga proses lancar penegak keadilan dan kebenaran di berikan keselamatan dan kekuatan amin,"['hanya', 'bisa', 'bantu', 'doa', 'semoga', 'proses', 'lancar', 'penegak', 'keadilan', 'dan', 'kebenaran', 'di', 'berikan', 'keselamatan', 'dan', 'kekuatan', 'amin']","['bantu', 'doa', 'semoga', 'proses', 'lancar', 'penegak', 'keadilan', 'kebenaran', 'berikan', 'keselamatan', 'kekuatan', 'amin']","['bantu', 'doa', 'moga', 'proses', 'lancar', 'tegak', 'adil', 'benar', 'ikan', 'selamat', 'kuat', 'amin']"
melawan mafia besar ini mempertaruhkan nyawa juga loh jadi bagi yg tdk bisa membantu suport minimal tdk menghujat karna kita blm mampu berdiri untuk di posisi beliau,melawan mafia besar ini mempertaruhkan nyawa juga loh jadi bagi yang tidak bisa membantu suport minimal tidak menghujat karena kita blm mampu berdiri untuk di posisi beliau,"['melawan', 'mafia', 'besar', 'ini', 'mempertaruhkan', 'nyawa', 'juga', 'loh', 'jadi', 'bagi', 'yang', 'tidak', 'bisa', 'membantu', 'suport', 'minimal', 'tidak', 'menghujat', 'karena', 'kita', 'blm', 'mampu', 'berdiri', 'untuk', 'di', 'posisi', 'beliau']","['melawan', 'mafia', 'besar', 'mempertaruhkan', 'nyawa', 'loh', 'jadi', 'tidak', 'membantu', 'suport', 'minimal', 'tidak', 'menghujat', 'blm', 'mampu', 'berdiri', 'posisi', 'beliau']","['lawan', 'mafia', 'besar', 'taruh', 'nyawa', 'loh', 'jadi', 'tidak', 'bantu', 'suport', 'minimal', 'tidak', 'hujat', 'blm', 'mampu', 'diri', 'posisi', 'beliau']"
si sri kebanyakan teori cari aman dan selamat dirinya sendiri,si sri kebanyakan teori cari aman dan selamat dirinya sendiri,"['si', 'sri', 'kebanyakan', 'teori', 'cari', 'aman', 'dan', 'selamat', 'dirinya', 'sendiri']","['si', 'sri', 'kebanyakan', 'teori', 'cari', 'aman', 'selamat', 'dirinya', 'sendiri']","['si', 'sri', 'banyak', 'teori', 'cari', 'aman', 'selamat', 'diri', 'sendiri']"
jangankan beacukai instansi pajak yg harusnya di benahi dan di awasi aja bu sri nga melakukan itu cortex yg mengalami kerugian triliunan aja beliau ga kudu ngapain kek apa kek,jangankan beacukai instansi pajak yang harusnya di benahi dan di awasi saja ibu sri tidak melakukan itu cortex yang mengalami kerugian triliunan saja beliau tidak harus apa seperti apa seperti,"['jangankan', 'beacukai', 'instansi', 'pajak', 'yang', 'harusnya', 'di', 'benahi', 'dan', 'di', 'awasi', 'saja', 'ibu', 'sri', 'tidak', 'melakukan', 'itu', 'cortex', 'yang', 'mengalami', 'kerugian', 'triliunan', 'saja', 'beliau', 'tidak', 'harus', 'apa', 'seperti', 'apa', 'seperti']","['jangankan', 'beacukai', 'instansi', 'pajak', 'harusnya', 'benahi', 'awasi', 'ibu', 'sri', 'tidak', 'melakukan', 'cortex', 'mengalami', 'kerugian', 'triliunan', 'beliau', 'tidak', 'apa', 'apa']","['jangan', 'beacukai', 'instansi', 'pajak', 'harus', 'benah', 'awas', 'ibu', 'sri', 'tidak', 'laku', 'cortex', 'alami', 'rugi', 'triliun', 'beliau', 'tidak', 'apa', 'apa']"
pgwai pjk cek smua lhkpn ny,pgwai pjk cek smua lhkpn nya,"['pgwai', 'pjk', 'cek', 'smua', 'lhkpn', 'nya']","['pgwai', 'pjk', 'cek', 'smua', 'lhkpn', 'nya']","['pgwai', 'pjk', 'cek', 'smua', 'lhkpn', 'nya']"
di kudus ditemukan ribuan cukai palsu mengingat kudus adalah kota kretek kemungkinan di kediri juga ada karena disana juga ada pabrik rokok terbesar,di kudus ditemukan ribuan cukai palsu mengingat kudus adalah kota kretek kemungkinan di kediri juga ada karena disana juga ada pabrik rokok terbesar,"['di', 'kudus', 'ditemukan', 'ribuan', 'cukai', 'palsu', 'mengingat', 'kudus', 'adalah', 'kota', 'kretek', 'kemungkinan', 'di', 'kediri', 'juga', 'ada', 'karena', 'disana', 'juga', 'ada', 'pabrik', 'rokok', 'terbesar']","['kudus', 'ditemukan', 'ribuan', 'cukai', 'palsu', 'mengingat', 'kudus', 'kota', 'kretek', 'kemungkinan', 'kediri', 'disana', 'pabrik', 'rokok', 'terbesar']","['kudus', 'temu', 'ribu', 'cukai', 'palsu', 'ingat', 'kudus', 'kota', 'kretek', 'mungkin', 'diri', 'sana', 'pabrik', 'rokok', 'besar']"
anda akan dilindungi rakyat pak,kamu akan dilindungi rakyat bapak,"['kamu', 'akan', 'dilindungi', 'rakyat', 'bapak']","['kamu', 'dilindungi', 'rakyat', 'bapak']","['kamu', 'lindung', 'rakyat', 'bapak']"
mana berani sri mulyani ,mana berani sri mulyani,"['mana', 'berani', 'sri', 'mulyani']","['mana', 'berani', 'sri', 'mulyani']","['mana', 'berani', 'sri', 'mulyani']"
lebih baik bergerak dng resiko dr pd tidak melakukan apapun sama sekali,lebih baik bergerak dng resiko dari percaya diri tidak melakukan apapun sama sekali,"['lebih', 'baik', 'bergerak', 'dng', 'resiko', 'dari', 'percaya', 'diri', 'tidak', 'melakukan', 'apapun', 'sama', 'sekali']","['lebih', 'baik', 'bergerak', 'dng', 'resiko', 'percaya', 'diri', 'tidak', 'melakukan', 'apapun', 'sama', 'sekali']","['lebih', 'baik', 'gerak', 'dng', 'resiko', 'percaya', 'diri', 'tidak', 'laku', 'apa', 'sama', 'sekali']"
itulah sumber dari berantakanya perdagangan mafia bea cukai,itulah sumber dari berantakanya perdagangan mafia bea cukai,"['itulah', 'sumber', 'dari', 'berantakanya', 'perdagangan', 'mafia', 'bea', 'cukai']","['sumber', 'berantakanya', 'perdagangan', 'mafia', 'bea', 'cukai']","['sumber', 'berantakanya', 'dagang', 'mafia', 'bea', 'cukai']"
menteri keuangan yang baru patut kita dukung kinerjanya jika memang untuk kepentingan bangsa negara ,menteri keuangan yang baru patut kita dukung kinerjanya jika memang untuk kepentingan bangsa negara,"['menteri', 'keuangan', 'yang', 'baru', 'patut', 'kita', 'dukung', 'kinerjanya', 'jika', 'memang', 'untuk', 'kepentingan', 'bangsa', 'negara']","['menteri', 'keuangan', 'baru', 'patut', 'dukung', 'kinerjanya', 'memang', 'kepentingan', 'bangsa', 'negara']","['menteri', 'uang', 'baru', 'patut', 'dukung', 'kerja', 'memang', 'penting', 'bangsa', 'negara']"
sri mul termasuk bagian,sri mul termasuk bagian,"['sri', 'mul', 'termasuk', 'bagian']","['sri', 'mul', 'termasuk', 'bagian']","['sri', 'mul', 'masuk', 'bagi']"
mantapngebul bisa murah lagi neh,mantapngebul bisa murah lagi neh,"['mantapngebul', 'bisa', 'murah', 'lagi', 'neh']","['mantapngebul', 'murah', 'neh']","['mantapngebul', 'murah', 'neh']"
seharusnya jangan dulu di posting kecuali kalau sudah ada yg ketangkap basah agar mereka tidak persiapan,seharusnya jangan dulu di posting kecuali kalau sudah ada yang ketangkap basah agar mereka tidak persiapan,"['seharusnya', 'jangan', 'dulu', 'di', 'posting', 'kecuali', 'kalau', 'sudah', 'ada', 'yang', 'ketangkap', 'basah', 'agar', 'mereka', 'tidak', 'persiapan']","['jangan', 'dulu', 'posting', 'kalau', 'ketangkap', 'basah', 'tidak', 'persiapan']","['jangan', 'dulu', 'posting', 'kalau', 'tangkap', 'basah', 'tidak', 'siap']"
sri otak nya bgmn caranya mengumpulkan uang yg banyak dr pajak bukan cara mengembangkanya,sri otak nya bgmn caranya mengumpulkan uang yang banyak dari pajak bukan cara mengembangkanya,"['sri', 'otak', 'nya', 'bgmn', 'caranya', 'mengumpulkan', 'uang', 'yang', 'banyak', 'dari', 'pajak', 'bukan', 'cara', 'mengembangkanya']","['sri', 'otak', 'nya', 'bgmn', 'caranya', 'mengumpulkan', 'uang', 'banyak', 'pajak', 'bukan', 'cara', 'mengembangkanya']","['sri', 'otak', 'nya', 'bgmn', 'cara', 'kumpul', 'uang', 'banyak', 'pajak', 'bukan', 'cara', 'mengembangkanya']"
pak purbaya cerdas mengelegar ,bapak purbaya cerdas mengelegar,"['bapak', 'purbaya', 'cerdas', 'mengelegar']","['bapak', 'purbaya', 'cerdas', 'mengelegar']","['bapak', 'purbaya', 'cerdas', 'legar']"
mantap teruskan pak,mantap teruskan bapak,"['mantap', 'teruskan', 'bapak']","['mantap', 'teruskan', 'bapak']","['mantap', 'terus', 'bapak']"
lanjut sikat mafia cukai ,lanjut sikat mafia cukai,"['lanjut', 'sikat', 'mafia', 'cukai']","['lanjut', 'sikat', 'mafia', 'cukai']","['lanjut', 'sikat', 'mafia', 'cukai']"
sudah permainan pemerintah ntar datang pahlawan ntar datang pengacau dah gitu aja disat rakyat mulai gerah datang yg kelihatan pahlawan kalau perlu masuk gorong gorong sekalian ,sudah permainan pemerintah nanti datang pahlawan nanti datang pengacau sudah gitu saja disat rakyat mulai gerah datang yang kelihatan pahlawan kalau perlu masuk gorong gorong sekalian,"['sudah', 'permainan', 'pemerintah', 'nanti', 'datang', 'pahlawan', 'nanti', 'datang', 'pengacau', 'sudah', 'gitu', 'saja', 'disat', 'rakyat', 'mulai', 'gerah', 'datang', 'yang', 'kelihatan', 'pahlawan', 'kalau', 'perlu', 'masuk', 'gorong', 'gorong', 'sekalian']","['permainan', 'pemerintah', 'datang', 'pahlawan', 'datang', 'pengacau', 'gitu', 'disat', 'rakyat', 'mulai', 'gerah', 'datang', 'kelihatan', 'pahlawan', 'kalau', 'perlu', 'masuk', 'gorong', 'gorong', 'sekalian']","['main', 'perintah', 'datang', 'pahlawan', 'datang', 'acau', 'gitu', 'sat', 'rakyat', 'mulai', 'gerah', 'datang', 'lihat', 'pahlawan', 'kalau', 'perlu', 'masuk', 'gorong', 'gorong', 'sekali']"
akhirnya bobrok mentri sblmnya kebongkar dikasih mentri yng sangat luar biasa bicara apa adanya sesuai dgn kenyatan mantap pak ubah semua kebijakan yg bobrok dr mentri sblmnya pak,akhirnya bobrok mentri sblmnya kebongkar dikasih mentri yang sangat luar biasa bicara apa adanya sesuai dengan kenyatan mantap bapak ubah semua kebijakan yang bobrok dari mentri sblmnya bapak,"['akhirnya', 'bobrok', 'mentri', 'sblmnya', 'kebongkar', 'dikasih', 'mentri', 'yang', 'sangat', 'luar', 'biasa', 'bicara', 'apa', 'adanya', 'sesuai', 'dengan', 'kenyatan', 'mantap', 'bapak', 'ubah', 'semua', 'kebijakan', 'yang', 'bobrok', 'dari', 'mentri', 'sblmnya', 'bapak']","['akhirnya', 'bobrok', 'mentri', 'sblmnya', 'kebongkar', 'dikasih', 'mentri', 'sangat', 'luar', 'biasa', 'bicara', 'apa', 'adanya', 'sesuai', 'kenyatan', 'mantap', 'bapak', 'ubah', 'semua', 'kebijakan', 'bobrok', 'mentri', 'sblmnya', 'bapak']","['akhir', 'bobrok', 'tri', 'sblmnya', 'bongkar', 'kasih', 'tri', 'sangat', 'luar', 'biasa', 'bicara', 'apa', 'ada', 'sesuai', 'kenyat', 'mantap', 'bapak', 'ubah', 'semua', 'bijak', 'bobrok', 'tri', 'sblmnya', 'bapak']"
buktikan dulu baru koar koar jgn putar kaset lama,buktikan dulu baru koar koar jangan putar kaset lama,"['buktikan', 'dulu', 'baru', 'koar', 'koar', 'jangan', 'putar', 'kaset', 'lama']","['buktikan', 'dulu', 'baru', 'koar', 'koar', 'jangan', 'putar', 'kaset', 'lama']","['bukti', 'dulu', 'baru', 'koar', 'koar', 'jangan', 'putar', 'kaset', 'lama']"
ayo di usut siapa tau ada keterlibatan,ayo di usut siapa tau ada keterlibatan,"['ayo', 'di', 'usut', 'siapa', 'tau', 'ada', 'keterlibatan']","['ayo', 'usut', 'siapa', 'tau', 'keterlibatan']","['ayo', 'usut', 'siapa', 'tau', 'libat']"
inget hisab kelak sri,ingat hisab kelak sri,"['ingat', 'hisab', 'kelak', 'sri']","['ingat', 'hisab', 'kelak', 'sri']","['ingat', 'hisab', 'kelak', 'sri']"
mentri pilihan jokowi gak ada yang bener,mentri pilihan jokowi tidak ada yang benar,"['mentri', 'pilihan', 'jokowi', 'tidak', 'ada', 'yang', 'benar']","['mentri', 'pilihan', 'jokowi', 'tidak', 'benar']","['tri', 'pilih', 'jokowi', 'tidak', 'benar']"
jangan lupa sowan ke solo bu,jangan lupa sowan ke solo ibu,"['jangan', 'lupa', 'sowan', 'ke', 'solo', 'ibu']","['jangan', 'lupa', 'sowan', 'solo', 'ibu']","['jangan', 'lupa', 'sowan', 'solo', 'ibu']"
si penghisap darah rakyat,si penghisap darah rakyat,"['si', 'penghisap', 'darah', 'rakyat']","['si', 'penghisap', 'darah', 'rakyat']","['si', 'penghisap', 'darah', 'rakyat']"
kang palak pensiun,kang palak pensiun,"['kang', 'palak', 'pensiun']","['kang', 'palak', 'pensiun']","['kang', 'palak', 'pensiun']"
si ratu pajak lagi menikmati hasil meras rakyat,si ratu pajak lagi menikmati hasil meras rakyat,"['si', 'ratu', 'pajak', 'lagi', 'menikmati', 'hasil', 'meras', 'rakyat']","['si', 'ratu', 'pajak', 'menikmati', 'hasil', 'meras', 'rakyat']","['si', 'ratu', 'pajak', 'nikmat', 'hasil', 'ras', 'rakyat']"
dibalang watu ae enake,dibalang watu ae enake,"['dibalang', 'watu', 'ae', 'enake']","['dibalang', 'watu', 'ae', 'enake']","['balang', 'watu', 'ae', 'enake']"
tukang pajak pensiun,tukang pajak pensiun,"['tukang', 'pajak', 'pensiun']","['tukang', 'pajak', 'pensiun']","['tukang', 'pajak', 'pensiun']"
dapat pensiunan bu bukanya beban apbn,dapat pensiunan ibu bukanya beban apbn,"['dapat', 'pensiunan', 'ibu', 'bukanya', 'beban', 'apbn']","['pensiunan', 'ibu', 'bukanya', 'beban', 'apbn']","['pensiun', 'ibu', 'buka', 'beban', 'apbn']"
orang yg anti kritik tiap ada yg komen di hapus terus di blokir sama dia,orang yang anti kritik tiap ada yang komen di hapus terus di blokir sama dia,"['orang', 'yang', 'anti', 'kritik', 'tiap', 'ada', 'yang', 'komen', 'di', 'hapus', 'terus', 'di', 'blokir', 'sama', 'dia']","['orang', 'anti', 'kritik', 'tiap', 'komen', 'hapus', 'terus', 'blokir', 'sama']","['orang', 'anti', 'kritik', 'tiap', 'komen', 'hapus', 'terus', 'blokir', 'sama']"
mau ke planet mars jga gpgk ada prestasinya,mau ke planet mars jga gpgk ada prestasinya,"['mau', 'ke', 'planet', 'mars', 'jga', 'gpgk', 'ada', 'prestasinya']","['mau', 'planet', 'mars', 'jga', 'gpgk', 'prestasinya']","['mau', 'planet', 'mars', 'jga', 'gpgk', 'prestasi']"
kang pajak,kang pajak,"['kang', 'pajak']","['kang', 'pajak']","['kang', 'pajak']"
tolong para akamsidi pantau,tolong para akamsidi pantau,"['tolong', 'para', 'akamsidi', 'pantau']","['akamsidi', 'pantau']","['akamsidi', 'pantau']"
pensiun kaya raya klo rakjat pensiun ngurus bpjs tk,pensiun seperti raya kalau rakjat pensiun ngurus bpjs tk,"['pensiun', 'seperti', 'raya', 'kalau', 'rakjat', 'pensiun', 'ngurus', 'bpjs', 'tk']","['pensiun', 'raya', 'kalau', 'rakjat', 'pensiun', 'ngurus', 'bpjs', 'tk']","['pensiun', 'raya', 'kalau', 'rakjat', 'pensiun', 'ngurus', 'bpjs', 'tk']"
santai bu enak gini gak tiap hari mikirin pajak apa lagi ya apalagi yg perlu dipalakin rakyatnya,santai ibu enak gini tidak tiap hari mikirin pajak apa lagi ya apalagi yang perlu dipalakin rakyatnya,"['santai', 'ibu', 'enak', 'gini', 'tidak', 'tiap', 'hari', 'mikirin', 'pajak', 'apa', 'lagi', 'ya', 'apalagi', 'yang', 'perlu', 'dipalakin', 'rakyatnya']","['santai', 'ibu', 'enak', 'gini', 'tidak', 'tiap', 'hari', 'mikirin', 'pajak', 'apa', 'perlu', 'dipalakin', 'rakyatnya']","['santai', 'ibu', 'enak', 'gin', 'tidak', 'tiap', 'hari', 'mikirin', 'pajak', 'apa', 'perlu', 'dipalakin', 'rakyat']"
 bu butidak ada yg membangakan darimu,ibu butidak ada yang membangakan darimu,"['ibu', 'butidak', 'ada', 'yang', 'membangakan', 'darimu']","['ibu', 'butidak', 'membangakan', 'darimu']","['ibu', 'butidak', 'membangakan', 'dari']"
dia mati skalian pun gw gak peduli,dia mati skalian pun aku tidak peduli,"['dia', 'mati', 'skalian', 'pun', 'aku', 'tidak', 'peduli']","['mati', 'skalian', 'aku', 'tidak', 'peduli']","['mati', 'skalian', 'aku', 'tidak', 'peduli']"
mentri hanya menyusahkan rakyat,mentri hanya menyusahkan rakyat,"['mentri', 'hanya', 'menyusahkan', 'rakyat']","['mentri', 'menyusahkan', 'rakyat']","['tri', 'susah', 'rakyat']"
pemalak pensiun,pemalak pensiun,"['pemalak', 'pensiun']","['pemalak', 'pensiun']","['malak', 'pensiun']"
wah jogja :,wah jogja :,"['wah', 'jogja', ':']","['wah', 'jogja', ':']","['wah', 'jogja', '']"
ratu pajak tersadis,ratu pajak tersadis,"['ratu', 'pajak', 'tersadis']","['ratu', 'pajak', 'tersadis']","['ratu', 'pajak', 'sad']"
knp gk dr dlu sri luh pensiun,kenapa tidak dari dulu sri luh pensiun,"['kenapa', 'tidak', 'dari', 'dulu', 'sri', 'luh', 'pensiun']","['tidak', 'dulu', 'sri', 'luh', 'pensiun']","['tidak', 'dulu', 'sri', 'luh', 'pensiun']"
si paling terbaikfaktanya suka naikin pajak,si paling terbaikfaktanya suka naikin pajak,"['si', 'paling', 'terbaikfaktanya', 'suka', 'naikin', 'pajak']","['si', 'paling', 'terbaikfaktanya', 'suka', 'naikin', 'pajak']","['si', 'paling', 'terbaikfaktanya', 'suka', 'naikin', 'pajak']"
ratu pajak dan sales world bank lagi nikmatin hasil keruk pajak,ratu pajak dan sales world bank lagi nikmatin hasil keruk pajak,"['ratu', 'pajak', 'dan', 'sales', 'world', 'bank', 'lagi', 'nikmatin', 'hasil', 'keruk', 'pajak']","['ratu', 'pajak', 'sales', 'world', 'bank', 'nikmatin', 'hasil', 'keruk', 'pajak']","['ratu', 'pajak', 'sales', 'world', 'bank', 'nikmatin', 'hasil', 'keruk', 'pajak']"
yogja apa mau ke solo kangen ya ,yogja apa mau ke solo kangen ya,"['yogja', 'apa', 'mau', 'ke', 'solo', 'kangen', 'ya']","['yogja', 'apa', 'mau', 'solo', 'kangen']","['yogja', 'apa', 'mau', 'solo', 'kangen']"
salah satu wajah penghuni neraka jahanam,salah satu wajah penghuni neraka jahanam,"['salah', 'satu', 'wajah', 'penghuni', 'neraka', 'jahanam']","['salah', 'satu', 'wajah', 'penghuni', 'neraka', 'jahanam']","['salah', 'satu', 'wajah', 'huni', 'neraka', 'jahanam']"
kirain pakai kaos kpk,kirain pakai kaos kpk,"['kirain', 'pakai', 'kaos', 'kpk']","['kirain', 'pakai', 'kaos', 'kpk']","['kirain', 'pakai', 'kaos', 'kpk']"
temanya hotman paris dan konglomerat lain nya,temanya hotman paris dan konglomerat lain nya,"['temanya', 'hotman', 'paris', 'dan', 'konglomerat', 'lain', 'nya']","['temanya', 'hotman', 'paris', 'konglomerat', 'nya']","['tema', 'hotman', 'paris', 'konglomerat', 'nya']"
baguslah dipecat sudah bikin ekonomi rusak saja,baguslah dipecat sudah bikin ekonomi rusak saja,"['baguslah', 'dipecat', 'sudah', 'bikin', 'ekonomi', 'rusak', 'saja']","['baguslah', 'dipecat', 'bikin', 'ekonomi', 'rusak']","['bagus', 'pecat', 'bikin', 'ekonomi', 'rusak']"
ouh ini yg nyekik rakyat lewat pajeknya dan nglindungi pejabat dr pajak,ouh ini yang nyekik rakyat lewat pajeknya dan nglindungi pejabat dari pajak,"['ouh', 'ini', 'yang', 'nyekik', 'rakyat', 'lewat', 'pajeknya', 'dan', 'nglindungi', 'pejabat', 'dari', 'pajak']","['ouh', 'nyekik', 'rakyat', 'lewat', 'pajeknya', 'nglindungi', 'pejabat', 'pajak']","['ouh', 'nyekik', 'rakyat', 'lewat', 'pajeknya', 'nglindungi', 'jabat', 'pajak']"
enak lah tabungan udah banyak,enak lah tabungan sudah banyak,"['enak', 'lah', 'tabungan', 'sudah', 'banyak']","['enak', 'lah', 'tabungan', 'banyak']","['enak', 'lah', 'tabung', 'banyak']"
lebih bagusan kinerja pak purbaya,lebih bagusan kinerja bapak purbaya,"['lebih', 'bagusan', 'kinerja', 'bapak', 'purbaya']","['lebih', 'bagusan', 'kinerja', 'bapak', 'purbaya']","['lebih', 'bagus', 'kerja', 'bapak', 'purbaya']"
ningalin hutang segunung ,ningalin hutang segunung,"['ningalin', 'hutang', 'segunung']","['ningalin', 'hutang', 'segunung']","['ningalin', 'hutang', 'gunung']"
ratu pajak,ratu pajak,"['ratu', 'pajak']","['ratu', 'pajak']","['ratu', 'pajak']"
semua seneng ibu seneng bisa liburan kita lebih seneng punya menkeu baru yg pro rakyat,semua senang ibu senang bisa liburan kita lebih senang punya menkeu baru yang pro rakyat,"['semua', 'senang', 'ibu', 'senang', 'bisa', 'liburan', 'kita', 'lebih', 'senang', 'punya', 'menkeu', 'baru', 'yang', 'pro', 'rakyat']","['semua', 'senang', 'ibu', 'senang', 'liburan', 'lebih', 'senang', 'punya', 'menkeu', 'baru', 'pro', 'rakyat']","['semua', 'senang', 'ibu', 'senang', 'libur', 'lebih', 'senang', 'punya', 'menkeu', 'baru', 'pro', 'rakyat']"
kang palak rakyat,kang palak rakyat,"['kang', 'palak', 'rakyat']","['kang', 'palak', 'rakyat']","['kang', 'palak', 'rakyat']"
siap melukis keren,siap melukis keren,"['siap', 'melukis', 'keren']","['siap', 'melukis', 'keren']","['siap', 'luk', 'keren']"
satnya nikmati hasil h,satnya nikmati hasil h,"['satnya', 'nikmati', 'hasil', 'h']","['satnya', 'nikmati', 'hasil', 'h']","['sat', 'nikmat', 'hasil', 'h']"
ratu pajak pro pejabat sekarang subur uangnya banyak,ratu pajak pro pejabat sekarang subur uangnya banyak,"['ratu', 'pajak', 'pro', 'pejabat', 'sekarang', 'subur', 'uangnya', 'banyak']","['ratu', 'pajak', 'pro', 'pejabat', 'sekarang', 'subur', 'uangnya', 'banyak']","['ratu', 'pajak', 'pro', 'jabat', 'sekarang', 'subur', 'uang', 'banyak']"
harusnya semua pejabat negara sesudah selesai wajib di periksa kpk yoy khans,harusnya semua pejabat negara sesudah selesai wajib di periksa kpk yoy khans,"['harusnya', 'semua', 'pejabat', 'negara', 'sesudah', 'selesai', 'wajib', 'di', 'periksa', 'kpk', 'yoy', 'khans']","['harusnya', 'semua', 'pejabat', 'negara', 'selesai', 'wajib', 'periksa', 'kpk', 'yoy', 'khans']","['harus', 'semua', 'jabat', 'negara', 'selesai', 'wajib', 'periksa', 'kpk', 'yoy', 'khans']"
drama quen sales imf,drama quen sales imf,"['drama', 'quen', 'sales', 'imf']","['drama', 'quen', 'sales', 'imf']","['drama', 'quen', 'sales', 'imf']"
tukang palak,tukang palak,"['tukang', 'palak']","['tukang', 'palak']","['tukang', 'palak']"
ratu pajak rakyat,ratu pajak rakyat,"['ratu', 'pajak', 'rakyat']","['ratu', 'pajak', 'rakyat']","['ratu', 'pajak', 'rakyat']"
