cleaned_comment,slang_replaced_comment,tekonized_comment,no_stopwords_comment,stemmed_comment
ikut dolar,ikut dolar,"['ikut', 'dolar']","['ikut', 'dolar']","['ikut', 'dolar']"
tombol yang mau ikut demo kalau pak purbaya di reshufle ,tombol yang mau ikut demo kalau bapak purbaya di reshufle,"['tombol', 'yang', 'mau', 'ikut', 'demo', 'kalau', 'bapak', 'purbaya', 'di', 'reshufle']","['tombol', 'mau', 'ikut', 'demo', 'kalau', 'bapak', 'purbaya', 'reshufle']","['tombol', 'mau', 'ikut', 'demo', 'kalau', 'bapak', 'purbaya', 'reshufle']"
gimana ekonomi indonesia mau membaik dapet menteri yg kerja nya bagus terancam reshufle,gimana ekonomi indonesia mau membaik dapat menteri yang kerja nya bagus terancam reshufle,"['gimana', 'ekonomi', 'indonesia', 'mau', 'membaik', 'dapat', 'menteri', 'yang', 'kerja', 'nya', 'bagus', 'terancam', 'reshufle']","['gimana', 'ekonomi', 'indonesia', 'mau', 'membaik', 'menteri', 'kerja', 'nya', 'bagus', 'terancam', 'reshufle']","['gimana', 'ekonomi', 'indonesia', 'mau', 'baik', 'menteri', 'kerja', 'nya', 'bagus', 'ancam', 'reshufle']"
nepalkan kalau pak purbaya di ganti,nepalkan kalau bapak purbaya di ganti,"['nepalkan', 'kalau', 'bapak', 'purbaya', 'di', 'ganti']","['nepalkan', 'kalau', 'bapak', 'purbaya', 'ganti']","['nepalkan', 'kalau', 'bapak', 'purbaya', 'ganti']"
dukung purbaya,dukung purbaya,"['dukung', 'purbaya']","['dukung', 'purbaya']","['dukung', 'purbaya']"
gas pak jgn takut smoga bapak alah lindungi niat bapak baik murni untuk masyarakan indonesia dan negara ini ,gas bapak jangan takut smoga bapak alah lindungi niat bapak baik murni untuk masyarakan indonesia dan negara ini,"['gas', 'bapak', 'jangan', 'takut', 'smoga', 'bapak', 'alah', 'lindungi', 'niat', 'bapak', 'baik', 'murni', 'untuk', 'masyarakan', 'indonesia', 'dan', 'negara', 'ini']","['gas', 'bapak', 'jangan', 'takut', 'smoga', 'bapak', 'alah', 'lindungi', 'niat', 'bapak', 'baik', 'murni', 'masyarakan', 'indonesia', 'negara']","['gas', 'bapak', 'jangan', 'takut', 'smoga', 'bapak', 'alah', 'lindung', 'niat', 'bapak', 'baik', 'murni', 'masyarakan', 'indonesia', 'negara']"
kalau memang terjadi berarti pemerintahan ini dalam kemdali geng solo,kalau memang terjadi berarti pemerintahan ini dalam kemdali geng solo,"['kalau', 'memang', 'terjadi', 'berarti', 'pemerintahan', 'ini', 'dalam', 'kemdali', 'geng', 'solo']","['kalau', 'memang', 'terjadi', 'berarti', 'pemerintahan', 'kemdali', 'geng', 'solo']","['kalau', 'memang', 'jadi', 'arti', 'perintah', 'kemdali', 'geng', 'solo']"
rakyat bersatu pak pur awas aja di reshufle ,rakyat bersatu bapak pur awas saja di reshufle,"['rakyat', 'bersatu', 'bapak', 'pur', 'awas', 'saja', 'di', 'reshufle']","['rakyat', 'bersatu', 'bapak', 'pur', 'awas', 'reshufle']","['rakyat', 'satu', 'bapak', 'pur', 'awas', 'reshufle']"
dpr kan dewan perwakilan rakyat orang rakyat nya setuju ama dia ngapain dpr komplen komplen fix tidak mewakili rakyat ,dpr kan dewan perwakilan rakyat orang rakyat nya setuju sama dia apa dpr komplen komplen tetap tidak mewakili rakyat,"['dpr', 'kan', 'dewan', 'perwakilan', 'rakyat', 'orang', 'rakyat', 'nya', 'setuju', 'sama', 'dia', 'apa', 'dpr', 'komplen', 'komplen', 'tetap', 'tidak', 'mewakili', 'rakyat']","['dpr', 'kan', 'dewan', 'perwakilan', 'rakyat', 'orang', 'rakyat', 'nya', 'setuju', 'sama', 'apa', 'dpr', 'komplen', 'komplen', 'tetap', 'tidak', 'mewakili', 'rakyat']","['dpr', 'kan', 'dewan', 'wakil', 'rakyat', 'orang', 'rakyat', 'nya', 'tuju', 'sama', 'apa', 'dpr', 'komplen', 'komplen', 'tetap', 'tidak', 'wakil', 'rakyat']"
justru masyarakat di perlihatkan kebenaran menurutku karena pejabat publik yang diusung parpol tidak pernah berorientasi ke rakyat andai sistem parpol dihapuskan mungkin ada ratusan pejabat publik kaya pak purbaya,justru masyarakat di perlihatkan kebenaran menurutku karena pejabat publik yang diusung parpol tidak pernah berorientasi ke rakyat andai sistem parpol dihapuskan mungkin ada ratusan pejabat publik seperti bapak purbaya,"['justru', 'masyarakat', 'di', 'perlihatkan', 'kebenaran', 'menurutku', 'karena', 'pejabat', 'publik', 'yang', 'diusung', 'parpol', 'tidak', 'pernah', 'berorientasi', 'ke', 'rakyat', 'andai', 'sistem', 'parpol', 'dihapuskan', 'mungkin', 'ada', 'ratusan', 'pejabat', 'publik', 'seperti', 'bapak', 'purbaya']","['justru', 'masyarakat', 'perlihatkan', 'kebenaran', 'menurutku', 'pejabat', 'publik', 'diusung', 'parpol', 'tidak', 'pernah', 'berorientasi', 'rakyat', 'andai', 'sistem', 'parpol', 'dihapuskan', 'mungkin', 'ratusan', 'pejabat', 'publik', 'bapak', 'purbaya']","['justru', 'masyarakat', 'lihat', 'benar', 'turut', 'jabat', 'publik', 'usung', 'parpol', 'tidak', 'pernah', 'orientasi', 'rakyat', 'andai', 'sistem', 'parpol', 'hapus', 'mungkin', 'ratus', 'jabat', 'publik', 'bapak', 'purbaya']"
kalau mang bener di resufle ancaman si opung benar di lakukan dan di kabulkan presiden,kalau mang benar di resufle ancaman si opung benar di lakukan dan di kabulkan presiden,"['kalau', 'mang', 'benar', 'di', 'resufle', 'ancaman', 'si', 'opung', 'benar', 'di', 'lakukan', 'dan', 'di', 'kabulkan', 'presiden']","['kalau', 'mang', 'benar', 'resufle', 'ancaman', 'si', 'opung', 'benar', 'lakukan', 'kabulkan', 'presiden']","['kalau', 'mang', 'benar', 'resufle', 'ancam', 'si', 'opung', 'benar', 'laku', 'kabul', 'presiden']"
blm setahun woi,blm setahun woi,"['blm', 'setahun', 'woi']","['blm', 'setahun', 'woi']","['blm', 'tahun', 'woi']"
baru aja dpt secercah harapan di negeri ini udah mau di padamin lagi rip konoha ,baru saja dapat secercah harapan di negeri ini sudah mau di padamin lagi rip konoha,"['baru', 'saja', 'dapat', 'secercah', 'harapan', 'di', 'negeri', 'ini', 'sudah', 'mau', 'di', 'padamin', 'lagi', 'rip', 'konoha']","['baru', 'secercah', 'harapan', 'negeri', 'mau', 'padamin', 'rip', 'konoha']","['baru', 'cercah', 'harap', 'negeri', 'mau', 'padamin', 'rip', 'konoha']"
pak purbaya ,bapak purbaya,"['bapak', 'purbaya']","['bapak', 'purbaya']","['bapak', 'purbaya']"
tandain org org yg ada di proyek whosh,tandain orang orang yang ada di proyek whosh,"['tandain', 'orang', 'orang', 'yang', 'ada', 'di', 'proyek', 'whosh']","['tandain', 'orang', 'orang', 'proyek', 'whosh']","['tandain', 'orang', 'orang', 'proyek', 'whosh']"
kalo sampe bener makin murka rakyat,kalau sampai benar makin murka rakyat,"['kalau', 'sampai', 'benar', 'makin', 'murka', 'rakyat']","['kalau', 'benar', 'makin', 'murka', 'rakyat']","['kalau', 'benar', 'makin', 'murka', 'rakyat']"
keren euy paksemangat,keren euy paksemangat,"['keren', 'euy', 'paksemangat']","['keren', 'euy', 'paksemangat']","['keren', 'euy', 'paksemangat']"
inalilahinegeri sarang penyamun,inalilahinegeri sarang penyamun,"['inalilahinegeri', 'sarang', 'penyamun']","['inalilahinegeri', 'sarang', 'penyamun']","['inalilahinegeri', 'sarang', 'samun']"
semoga sehat walafiah bapak sekeluarga dan selalu dalam lindungan alah alohuma soliala sayidina muhamad wa ala ali sayidina muhamad ,semoga sehat walafiah bapak sekeluarga dan selalu dalam lindungan alah alohuma soliala sayidina muhamad whatsapp ala ali sayidina muhamad,"['semoga', 'sehat', 'walafiah', 'bapak', 'sekeluarga', 'dan', 'selalu', 'dalam', 'lindungan', 'alah', 'alohuma', 'soliala', 'sayidina', 'muhamad', 'whatsapp', 'ala', 'ali', 'sayidina', 'muhamad']","['semoga', 'sehat', 'walafiah', 'bapak', 'sekeluarga', 'selalu', 'lindungan', 'alah', 'alohuma', 'soliala', 'sayidina', 'muhamad', 'whatsapp', 'ala', 'ali', 'sayidina', 'muhamad']","['moga', 'sehat', 'walafiah', 'bapak', 'keluarga', 'selalu', 'lindung', 'alah', 'alohuma', 'soliala', 'sayidina', 'muhamad', 'whatsapp', 'ala', 'ali', 'sayidina', 'muhamad']"
rakyat yg bakal turun ke jalan kalo sampe pak purbaya di reshufle enak aja tuh si luhut udah malingin duit rakyat malah purbaya yg di pecat,rakyat yang akan turun ke jalan kalau sampai bapak purbaya di reshufle enak saja itu si luhut sudah malingin uang rakyat malah purbaya yang di pecat,"['rakyat', 'yang', 'akan', 'turun', 'ke', 'jalan', 'kalau', 'sampai', 'bapak', 'purbaya', 'di', 'reshufle', 'enak', 'saja', 'itu', 'si', 'luhut', 'sudah', 'malingin', 'uang', 'rakyat', 'malah', 'purbaya', 'yang', 'di', 'pecat']","['rakyat', 'turun', 'jalan', 'kalau', 'bapak', 'purbaya', 'reshufle', 'enak', 'si', 'luhut', 'malingin', 'uang', 'rakyat', 'malah', 'purbaya', 'pecat']","['rakyat', 'turun', 'jalan', 'kalau', 'bapak', 'purbaya', 'reshufle', 'enak', 'si', 'luhut', 'malingin', 'uang', 'rakyat', 'malah', 'purbaya', 'pecat']"
pejabat dzolim nugarelo sing geura modyar,pejabat dzolim nugarelo sing geura modyar,"['pejabat', 'dzolim', 'nugarelo', 'sing', 'geura', 'modyar']","['pejabat', 'dzolim', 'nugarelo', 'sing', 'geura', 'modyar']","['jabat', 'dzolim', 'nugarelo', 'sing', 'geura', 'modyar']"
knapa orang jujur mau d resapel apa salah nya,knapa orang jujur mau di resapel apa salah nya,"['knapa', 'orang', 'jujur', 'mau', 'di', 'resapel', 'apa', 'salah', 'nya']","['knapa', 'orang', 'jujur', 'mau', 'resapel', 'apa', 'salah', 'nya']","['knapa', 'orang', 'jujur', 'mau', 'resapel', 'apa', 'salah', 'nya']"
indo indo,indonesia indonesia,"['indonesia', 'indonesia']","['indonesia', 'indonesia']","['indonesia', 'indonesia']"
gas terus pak purbaya jangan kendor pecat luhut,gas terus bapak purbaya jangan kendor pecat luhut,"['gas', 'terus', 'bapak', 'purbaya', 'jangan', 'kendor', 'pecat', 'luhut']","['gas', 'terus', 'bapak', 'purbaya', 'jangan', 'kendor', 'pecat', 'luhut']","['gas', 'terus', 'bapak', 'purbaya', 'jangan', 'kendor', 'pecat', 'luhut']"
jangan dong alasanya ituloh ,jangan dong alasanya ituloh,"['jangan', 'dong', 'alasanya', 'ituloh']","['jangan', 'dong', 'alasanya', 'ituloh']","['jangan', 'dong', 'alasanya', 'ituloh']"
gue turun ke jalan klo sampe bapak ini di reshufle kalau perlu demo aja kita ,aku turun ke jalan kalau sampai bapak ini di reshufle kalau perlu demo saja kita,"['aku', 'turun', 'ke', 'jalan', 'kalau', 'sampai', 'bapak', 'ini', 'di', 'reshufle', 'kalau', 'perlu', 'demo', 'saja', 'kita']","['aku', 'turun', 'jalan', 'kalau', 'bapak', 'reshufle', 'kalau', 'perlu', 'demo']","['aku', 'turun', 'jalan', 'kalau', 'bapak', 'reshufle', 'kalau', 'perlu', 'demo']"
yg harus di resufle bukan nya mentri esdy ya ini saya yg bodoh atau para pemimpin di negeri ini yang buta mereka kerja untuk siapa sihrakyat nya atau diri sendiri,yang harus di resufle bukan nya mentri esdy ya ini aku yang bodoh atau para pemimpin di negeri ini yang buta mereka kerja untuk siapa sihrakyat nya atau diri sendiri,"['yang', 'harus', 'di', 'resufle', 'bukan', 'nya', 'mentri', 'esdy', 'ya', 'ini', 'aku', 'yang', 'bodoh', 'atau', 'para', 'pemimpin', 'di', 'negeri', 'ini', 'yang', 'buta', 'mereka', 'kerja', 'untuk', 'siapa', 'sihrakyat', 'nya', 'atau', 'diri', 'sendiri']","['resufle', 'bukan', 'nya', 'mentri', 'esdy', 'aku', 'bodoh', 'pemimpin', 'negeri', 'buta', 'kerja', 'siapa', 'sihrakyat', 'nya', 'diri', 'sendiri']","['resufle', 'bukan', 'nya', 'tri', 'esdy', 'aku', 'bodoh', 'pimpin', 'negeri', 'buta', 'kerja', 'siapa', 'sihrakyat', 'nya', 'diri', 'sendiri']"
adu kuat aja tekanan politik vs tekanan rakyat indonesia,adu kuat saja tekanan politik vs tekanan rakyat indonesia,"['adu', 'kuat', 'saja', 'tekanan', 'politik', 'vs', 'tekanan', 'rakyat', 'indonesia']","['adu', 'kuat', 'tekanan', 'politik', 'vs', 'tekanan', 'rakyat', 'indonesia']","['adu', 'kuat', 'tekan', 'politik', 'vs', 'tekan', 'rakyat', 'indonesia']"
demo dirumah luhut jokowi,demo dirumah luhut jokowi,"['demo', 'dirumah', 'luhut', 'jokowi']","['demo', 'dirumah', 'luhut', 'jokowi']","['demo', 'rumah', 'luhut', 'jokowi']"
santai pak bapak di ganti kita yg turun ,santai bapak bapak di ganti kita yang turun,"['santai', 'bapak', 'bapak', 'di', 'ganti', 'kita', 'yang', 'turun']","['santai', 'bapak', 'bapak', 'ganti', 'turun']","['santai', 'bapak', 'bapak', 'ganti', 'turun']"
pengen di demo lagi klo pa purbaya di reshufle rakyat udah muak sama kalian yang pada serakah korup,ingin di demo lagi kalau bapak purbaya di reshufle rakyat sudah muak sama kalian yang pada serakah korup,"['ingin', 'di', 'demo', 'lagi', 'kalau', 'bapak', 'purbaya', 'di', 'reshufle', 'rakyat', 'sudah', 'muak', 'sama', 'kalian', 'yang', 'pada', 'serakah', 'korup']","['demo', 'kalau', 'bapak', 'purbaya', 'reshufle', 'rakyat', 'muak', 'sama', 'kalian', 'serakah', 'korup']","['demo', 'kalau', 'bapak', 'purbaya', 'reshufle', 'rakyat', 'muak', 'sama', 'kalian', 'serakah', 'korup']"
rakyat harus kompak kita nepalkan perampok yg menjarah kekayan indonesia ,rakyat harus kompak kita nepalkan perampok yang menjarah kekayan indonesia,"['rakyat', 'harus', 'kompak', 'kita', 'nepalkan', 'perampok', 'yang', 'menjarah', 'kekayan', 'indonesia']","['rakyat', 'kompak', 'nepalkan', 'perampok', 'menjarah', 'kekayan', 'indonesia']","['rakyat', 'kompak', 'nepalkan', 'rampok', 'jarah', 'kayan', 'indonesia']"
lah kalo bener tekanan itu datang dari jokowi cs ga manuk akal juga karena dia juga ga punya parpol,lah kalau benar tekanan itu datang dari jokowi cs tidak manuk akal juga karena dia juga tidak punya parpol,"['lah', 'kalau', 'benar', 'tekanan', 'itu', 'datang', 'dari', 'jokowi', 'cs', 'tidak', 'manuk', 'akal', 'juga', 'karena', 'dia', 'juga', 'tidak', 'punya', 'parpol']","['lah', 'kalau', 'benar', 'tekanan', 'datang', 'jokowi', 'cs', 'tidak', 'manuk', 'akal', 'tidak', 'punya', 'parpol']","['lah', 'kalau', 'benar', 'tekan', 'datang', 'jokowi', 'cs', 'tidak', 'manuk', 'akal', 'tidak', 'punya', 'parpol']"
luhut ni menghambat indo maju aja woe ,luhut ini menghambat indonesia maju saja woe,"['luhut', 'ini', 'menghambat', 'indonesia', 'maju', 'saja', 'woe']","['luhut', 'menghambat', 'indonesia', 'maju', 'woe']","['luhut', 'hambat', 'indonesia', 'maju', 'woe']"
dan ryt tahu siapa yg plg bertangung jawab jk itu terjadi,dan ryt tahu siapa yang plg bertangung jawab gurau itu terjadi,"['dan', 'ryt', 'tahu', 'siapa', 'yang', 'plg', 'bertangung', 'jawab', 'gurau', 'itu', 'terjadi']","['ryt', 'tahu', 'siapa', 'plg', 'bertangung', 'jawab', 'gurau', 'terjadi']","['ryt', 'tahu', 'siapa', 'plg', 'bertangung', 'jawab', 'gurau', 'jadi']"
heran gw mah giliran ada yang bener reshufle ni negara emang ga bakal maju begini terus aja kelakuanampun dah,heran aku mah giliran ada yang benar reshufle ini negara memang tidak akan maju begini terus saja kelakuanampun sudah,"['heran', 'aku', 'mah', 'giliran', 'ada', 'yang', 'benar', 'reshufle', 'ini', 'negara', 'memang', 'tidak', 'akan', 'maju', 'begini', 'terus', 'saja', 'kelakuanampun', 'sudah']","['heran', 'aku', 'mah', 'giliran', 'benar', 'reshufle', 'negara', 'memang', 'tidak', 'maju', 'begini', 'terus', 'kelakuanampun']","['heran', 'aku', 'mah', 'gilir', 'benar', 'reshufle', 'negara', 'memang', 'tidak', 'maju', 'begini', 'terus', 'kelakuanampun']"
kalau sampai itu terjadi ryt akan semakin bersatu menghadapinya kt lihat sj,kalau sampai itu terjadi ryt akan semakin bersatu menghadapinya kt lihat sj,"['kalau', 'sampai', 'itu', 'terjadi', 'ryt', 'akan', 'semakin', 'bersatu', 'menghadapinya', 'kt', 'lihat', 'sj']","['kalau', 'terjadi', 'ryt', 'semakin', 'bersatu', 'menghadapinya', 'kt', 'lihat', 'sj']","['kalau', 'jadi', 'ryt', 'makin', 'satu', 'hadap', 'kt', 'lihat', 'sj']"
jangan sampai di reshufle,jangan sampai di reshufle,"['jangan', 'sampai', 'di', 'reshufle']","['jangan', 'reshufle']","['jangan', 'reshufle']"
ya di reshufle balik ma rakyatmereka yg mau menjegal pak pur,ya di reshufle balik ma rakyatmereka yang mau menjegal bapak pur,"['ya', 'di', 'reshufle', 'balik', 'ma', 'rakyatmereka', 'yang', 'mau', 'menjegal', 'bapak', 'pur']","['reshufle', 'balik', 'ma', 'rakyatmereka', 'mau', 'menjegal', 'bapak', 'pur']","['reshufle', 'balik', 'ma', 'rakyatmereka', 'mau', 'jegal', 'bapak', 'pur']"
kami bersama pak purbaya,kami bersama bapak purbaya,"['kami', 'bersama', 'bapak', 'purbaya']","['bersama', 'bapak', 'purbaya']","['sama', 'bapak', 'purbaya']"
luhut itu pensiunkanotak nya jokowi itu,luhut itu pensiunkanotak nya jokowi itu,"['luhut', 'itu', 'pensiunkanotak', 'nya', 'jokowi', 'itu']","['luhut', 'pensiunkanotak', 'nya', 'jokowi']","['luhut', 'pensiunkanotak', 'nya', 'jokowi']"
demo lg aja,demo lagi saja,"['demo', 'lagi', 'saja']",['demo'],['demo']
reshufle karena ga kerja reshufle karena banyak yang keancam proyeknya dagelan mulu ah,reshufle karena tidak kerja reshufle karena banyak yang keancam proyeknya dagelan selalu ah,"['reshufle', 'karena', 'tidak', 'kerja', 'reshufle', 'karena', 'banyak', 'yang', 'keancam', 'proyeknya', 'dagelan', 'selalu', 'ah']","['reshufle', 'tidak', 'kerja', 'reshufle', 'banyak', 'keancam', 'proyeknya', 'dagelan', 'selalu', 'ah']","['reshufle', 'tidak', 'kerja', 'reshufle', 'banyak', 'ancam', 'proyek', 'dagel', 'selalu', 'ah']"
knp gk si lumut mn uang d pke sama ponakanya ,kenapa tidak si lumut mn uang di pke sama ponakanya,"['kenapa', 'tidak', 'si', 'lumut', 'mn', 'uang', 'di', 'pke', 'sama', 'ponakanya']","['tidak', 'si', 'lumut', 'mn', 'uang', 'pke', 'sama', 'ponakanya']","['tidak', 'si', 'lumut', 'mn', 'uang', 'pke', 'sama', 'ponakanya']"
kalau sampe di copot berarti ,kalau sampai di copot berarti,"['kalau', 'sampai', 'di', 'copot', 'berarti']","['kalau', 'copot', 'berarti']","['kalau', 'copot', 'arti']"
luhut ini kan dulu sakit keras kenapa pake sembuh sih ,luhut ini kan dulu sakit keras kenapa pakai sembuh sih,"['luhut', 'ini', 'kan', 'dulu', 'sakit', 'keras', 'kenapa', 'pakai', 'sembuh', 'sih']","['luhut', 'kan', 'dulu', 'sakit', 'keras', 'pakai', 'sembuh', 'sih']","['luhut', 'kan', 'dulu', 'sakit', 'keras', 'pakai', 'sembuh', 'sih']"
hahahaha siapa yang akan menjadi bahan bakar neraka jahanam menurut alquran jawab sendiri aja deh,hahahaha siapa yang akan menjadi bahan bakar neraka jahanam menurut alquran jawab sendiri saja deh,"['hahahaha', 'siapa', 'yang', 'akan', 'menjadi', 'bahan', 'bakar', 'neraka', 'jahanam', 'menurut', 'alquran', 'jawab', 'sendiri', 'saja', 'deh']","['hahahaha', 'siapa', 'menjadi', 'bahan', 'bakar', 'neraka', 'jahanam', 'alquran', 'jawab', 'sendiri', 'deh']","['hahahaha', 'siapa', 'jadi', 'bahan', 'bakar', 'neraka', 'jahanam', 'alquran', 'jawab', 'sendiri', 'deh']"
semua gara joko,semua gara joko,"['semua', 'gara', 'joko']","['semua', 'gara', 'joko']","['semua', 'gara', 'joko']"
demo nepalkan pejabat yg korup ,demo nepalkan pejabat yang korup,"['demo', 'nepalkan', 'pejabat', 'yang', 'korup']","['demo', 'nepalkan', 'pejabat', 'korup']","['demo', 'nepalkan', 'jabat', 'korup']"
kalau purbaya direshufle kita bubar aja jadi negara percuma,kalau purbaya direshufle kita bubar saja jadi negara percuma,"['kalau', 'purbaya', 'direshufle', 'kita', 'bubar', 'saja', 'jadi', 'negara', 'percuma']","['kalau', 'purbaya', 'direshufle', 'bubar', 'jadi', 'negara', 'percuma']","['kalau', 'purbaya', 'direshufle', 'bubar', 'jadi', 'negara', 'percuma']"
bahlil aja yg di reshufle,bahlil saja yang di reshufle,"['bahlil', 'saja', 'yang', 'di', 'reshufle']","['bahlil', 'reshufle']","['bahlil', 'reshufle']"
p luhut p bahlil aja yg di reshufle beliau berdua lgsg dipangil ke akhirat pun saya ikhlas ya alah,p luhut p bahlil saja yang di reshufle beliau berdua langsung dipangil ke akhirat pun aku ikhlas ya alah,"['p', 'luhut', 'p', 'bahlil', 'saja', 'yang', 'di', 'reshufle', 'beliau', 'berdua', 'langsung', 'dipangil', 'ke', 'akhirat', 'pun', 'aku', 'ikhlas', 'ya', 'alah']","['p', 'luhut', 'p', 'bahlil', 'reshufle', 'beliau', 'berdua', 'langsung', 'dipangil', 'akhirat', 'aku', 'ikhlas', 'alah']","['p', 'luhut', 'p', 'bahlil', 'reshufle', 'beliau', 'dua', 'langsung', 'dipangil', 'akhirat', 'aku', 'ikhlas', 'alah']"
nilai bagus gini masa terancam reshufle org yg ga keliatan kerja nya kga di reshufle,nilai bagus gini masa terancam reshufle orang yang tidak keliatan kerja nya kga di reshufle,"['nilai', 'bagus', 'gini', 'masa', 'terancam', 'reshufle', 'orang', 'yang', 'tidak', 'keliatan', 'kerja', 'nya', 'kga', 'di', 'reshufle']","['nilai', 'bagus', 'gini', 'masa', 'terancam', 'reshufle', 'orang', 'tidak', 'keliatan', 'kerja', 'nya', 'kga', 'reshufle']","['nilai', 'bagus', 'gin', 'masa', 'ancam', 'reshufle', 'orang', 'tidak', 'liat', 'kerja', 'nya', 'kga', 'reshufle']"
lawan kezaliman dukung purbaya brantas korupsi ,lawan kezaliman dukung purbaya brantas korupsi,"['lawan', 'kezaliman', 'dukung', 'purbaya', 'brantas', 'korupsi']","['lawan', 'kezaliman', 'dukung', 'purbaya', 'brantas', 'korupsi']","['lawan', 'zalim', 'dukung', 'purbaya', 'brantas', 'korupsi']"
fix kalo pur kena resufle kita di pimpin anak sd org pintar kalah oleh org dungu yg punya kekuasan,tetap kalau pur kena resufle kita di pimpin anak sd orang pintar kalah oleh orang dungu yang punya kekuasan,"['tetap', 'kalau', 'pur', 'kena', 'resufle', 'kita', 'di', 'pimpin', 'anak', 'sd', 'orang', 'pintar', 'kalah', 'oleh', 'orang', 'dungu', 'yang', 'punya', 'kekuasan']","['tetap', 'kalau', 'pur', 'kena', 'resufle', 'pimpin', 'anak', 'sd', 'orang', 'pintar', 'kalah', 'orang', 'dungu', 'punya', 'kekuasan']","['tetap', 'kalau', 'pur', 'kena', 'resufle', 'pimpin', 'anak', 'sd', 'orang', 'pintar', 'kalah', 'orang', 'dungu', 'punya', 'kuas']"
tombol fix demo kalo pak purbaya di reshufle ,tombol tetap demo kalau bapak purbaya di reshufle,"['tombol', 'tetap', 'demo', 'kalau', 'bapak', 'purbaya', 'di', 'reshufle']","['tombol', 'tetap', 'demo', 'kalau', 'bapak', 'purbaya', 'reshufle']","['tombol', 'tetap', 'demo', 'kalau', 'bapak', 'purbaya', 'reshufle']"
rakyat indonesia tidak boleh tingal diam dua orang yang paling bertangungjawab atas bobroknya tata kelola pemerintahan dan keuangan negara luhut dan jokowi layak diadili dmo besar besaran opsi yg tidak bisa dihindarkan,rakyat indonesia tidak boleh tingal diam dua orang yang paling bertangungjawab atas bobroknya tata kelola pemerintahan dan keuangan negara luhut dan jokowi layak diadili dmo besar besaran pilihan yang tidak bisa dihindarkan,"['rakyat', 'indonesia', 'tidak', 'boleh', 'tingal', 'diam', 'dua', 'orang', 'yang', 'paling', 'bertangungjawab', 'atas', 'bobroknya', 'tata', 'kelola', 'pemerintahan', 'dan', 'keuangan', 'negara', 'luhut', 'dan', 'jokowi', 'layak', 'diadili', 'dmo', 'besar', 'besaran', 'pilihan', 'yang', 'tidak', 'bisa', 'dihindarkan']","['rakyat', 'indonesia', 'tidak', 'tingal', 'diam', 'orang', 'paling', 'bertangungjawab', 'atas', 'bobroknya', 'tata', 'kelola', 'pemerintahan', 'keuangan', 'negara', 'luhut', 'jokowi', 'layak', 'diadili', 'dmo', 'besar', 'besaran', 'pilihan', 'tidak', 'dihindarkan']","['rakyat', 'indonesia', 'tidak', 'tingal', 'diam', 'orang', 'paling', 'bertangungjawab', 'atas', 'bobrok', 'tata', 'kelola', 'perintah', 'uang', 'negara', 'luhut', 'jokowi', 'layak', 'adil', 'dmo', 'besar', 'besar', 'pilih', 'tidak', 'hindar']"
genk solo mulai gusar ,genk solo mulai gusar,"['genk', 'solo', 'mulai', 'gusar']","['genk', 'solo', 'mulai', 'gusar']","['genk', 'solo', 'mulai', 'gusar']"
rakyat bersamamu pa mentri kekuasan tertingi ada di rakyat kalau pa menteri di ganti kami siap luluhlsntahkan dpr,rakyat bersamamu bapak mentri kekuasan tertingi ada di rakyat kalau bapak menteri di ganti kami siap luluhlsntahkan dpr,"['rakyat', 'bersamamu', 'bapak', 'mentri', 'kekuasan', 'tertingi', 'ada', 'di', 'rakyat', 'kalau', 'bapak', 'menteri', 'di', 'ganti', 'kami', 'siap', 'luluhlsntahkan', 'dpr']","['rakyat', 'bersamamu', 'bapak', 'mentri', 'kekuasan', 'tertingi', 'rakyat', 'kalau', 'bapak', 'menteri', 'ganti', 'siap', 'luluhlsntahkan', 'dpr']","['rakyat', 'sama', 'bapak', 'tri', 'kuas', 'tingi', 'rakyat', 'kalau', 'bapak', 'menteri', 'ganti', 'siap', 'luluhlsntahkan', 'dpr']"
kalau saya sih mending yg di resufle luhut udah kelaman di pemerintahan udah mah segala jabatan dia makan,kalau aku sih mending yang di resufle luhut sudah kelaman di pemerintahan sudah mah segala jabatan dia makan,"['kalau', 'aku', 'sih', 'mending', 'yang', 'di', 'resufle', 'luhut', 'sudah', 'kelaman', 'di', 'pemerintahan', 'sudah', 'mah', 'segala', 'jabatan', 'dia', 'makan']","['kalau', 'aku', 'sih', 'mending', 'resufle', 'luhut', 'kelaman', 'pemerintahan', 'mah', 'segala', 'jabatan', 'makan']","['kalau', 'aku', 'sih', 'mending', 'resufle', 'luhut', 'kelam', 'perintah', 'mah', 'segala', 'jabat', 'makan']"
siapa takutalohukbar,siapa takutalohukbar,"['siapa', 'takutalohukbar']","['siapa', 'takutalohukbar']","['siapa', 'takutalohukbar']"
kalau memang terjadirakyat tau kan harus berbuat apa,kalau memang terjadirakyat tau kan harus berbuat apa,"['kalau', 'memang', 'terjadirakyat', 'tau', 'kan', 'harus', 'berbuat', 'apa']","['kalau', 'memang', 'terjadirakyat', 'tau', 'kan', 'berbuat', 'apa']","['kalau', 'memang', 'terjadirakyat', 'tau', 'kan', 'buat', 'apa']"
mau kerja bener ada aja halanganya ya alah,mau kerja benar ada saja halanganya ya alah,"['mau', 'kerja', 'benar', 'ada', 'saja', 'halanganya', 'ya', 'alah']","['mau', 'kerja', 'benar', 'halanganya', 'alah']","['mau', 'kerja', 'benar', 'halanganya', 'alah']"
persiapkan sunscren kalian persiapan demo geden,persiapkan sunscren kalian persiapan demo geden,"['persiapkan', 'sunscren', 'kalian', 'persiapan', 'demo', 'geden']","['persiapkan', 'sunscren', 'kalian', 'persiapan', 'demo', 'geden']","['siap', 'sunscren', 'kalian', 'siap', 'demo', 'geden']"
kakek luhut dan kawan yg sudah berumur mohon pengertian waktunya istirahat di rumah ,kakek luhut dan teman yang sudah berumur mohon pengertian waktunya istirahat di rumah,"['kakek', 'luhut', 'dan', 'teman', 'yang', 'sudah', 'berumur', 'mohon', 'pengertian', 'waktunya', 'istirahat', 'di', 'rumah']","['kakek', 'luhut', 'teman', 'berumur', 'mohon', 'pengertian', 'waktunya', 'istirahat', 'rumah']","['kakek', 'luhut', 'teman', 'umur', 'mohon', 'erti', 'waktu', 'istirahat', 'rumah']"
